id,gender,masterCategory,subCategory,articleType,baseColour,season,year,usage,productDisplayName
17027,Men,Footwear,Flip Flops,Flip Flops,Navy Blue,Spring,2013,Casual,Gas Men Navy Blue Flip Flops
17030,Men,Footwear,Flip Flops,Flip Flops,Brown,Spring,2013,Casual,Gas Men Brown Wave Flip Flops
17031,Men,Footwear,Flip Flops,Flip Flops,Black,Spring,2013,Casual,Gas Men Black Wave Flip Flops
17032,Men,Footwear,Shoes,Casual Shoes,Red,Summer,2013,Casual,GAS Men Red Europa Sneakers
17036,Men,Footwear,Shoes,Casual Shoes,White,Summer,2013,Casual,Gas Men Caddy Casual Shoe
17037,Men,Footwear,Shoes,Casual Shoes,Grey,Summer,2013,Casual,GAS Men Grey & Brown Caddy Sneakers
17670,Women,Footwear,Shoes,Heels,Black,Winter,2015,Casual,Catwalk Women Fancy Black Heels
17671,Women,Footwear,Shoes,Heels,Beige,Winter,2015,Casual,Catwalk Women Fancy Beige Heels
17672,Women,Footwear,Shoes,Heels,Brown,Winter,2015,Casual,Catwalk Women Brown Pumps
17673,Women,Footwear,Shoes,Heels,Black,Winter,2015,Casual,Catwalk Women Black Pumps
17674,Women,Footwear,Shoes,Flats,Red,Winter,2015,Casual,Catwalk Women Ballerina Red Casual Shoe
17675,Women,Footwear,Shoes,Flats,Turquoise Blue,Winter,2015,Casual,Catwalk Women Ballerina Turquoise Casual Shoe
17676,Women,Footwear,Shoes,Heels,Black,Winter,2015,Casual,Catwalk Women Weaved Strap Black Flats
17677,Women,Footwear,Shoes,Heels,Tan,Winter,2015,Casual,Catwalk Women Weaved Strap Tan Flats
17680,Women,Footwear,Shoes,Heels,Grey,Winter,2015,Casual,Catwalk Women Flower Grey Heels
17682,Women,Footwear,Shoes,Casual Shoes,Blue,Winter,2015,Casual,Catwalk Women Closed Blue Casual Shoe
17684,Women,Footwear,Shoes,Casual Shoes,Grey,Winter,2015,Casual,Catwalk Women Ballerina Grey Casual Shoe
17685,Women,Footwear,Shoes,Heels,Multi,Winter,2015,Casual,Catwalk Women Assorted Multi Heels
17686,Women,Footwear,Shoes,Heels,Multi,Winter,2015,Casual,Catwalk Women Sequins Multi Wedges
17687,Women,Footwear,Shoes,Heels,White,Winter,2015,Casual,Catwalk Women Classic White Heels
17696,Men,Footwear,Shoes,Casual Shoes,Black,Autumn,2011,Casual,Vans Men Rata Vulc Black Casual Shoes
17697,Men,Footwear,Shoes,Casual Shoes,Grey,Autumn,2011,Casual,Vans Men Bali Grey Casual Shoes
17704,Unisex,Footwear,Shoes,Casual Shoes,Maroon,Autumn,2011,Casual,Vans unisex Old Skool Red Casual Shoes
17705,Unisex,Footwear,Shoes,Casual Shoes,Black,Autumn,2011,Casual,Vans unisex Era Black Casual Shoes
17712,Women,Footwear,Shoes,Casual Shoes,Grey,Autumn,2011,Casual,Vans Women E-Street Grey Casual Shoes
17737,Women,Footwear,Shoes,Flats,Black,Autumn,2011,Casual,Puma Women Body Train Black Slipper
17738,Men,Footwear,Shoes,Sports Shoes,Black,Autumn,2011,Sports,Puma Men Voltaic WP Black Sports Shoe
17745,Men,Footwear,Shoes,Sports Shoes,White,Autumn,2011,Sports,Puma Men Voltaic WP White Sports Shoe
17761,Men,Footwear,Shoes,Formal Shoes,Brown,Winter,2011,Formal,Buckaroo Men Ortiz Brown Semi Formal Shoe
17762,Men,Footwear,Shoes,Formal Shoes,Black,Winter,2011,Formal,Buckaroo Men Ortiz Black Formal Shoe
17763,Men,Footwear,Shoes,Formal Shoes,Black,Winter,2011,Formal,Buckaroo Men Tos Black Formal Shoe
17771,Men,Accessories,Belts,Belts,Brown,Autumn,2011,Formal,Reid & Taylor Men Classic Brown Belt
17796,Men,Apparel,Topwear,Tshirts,Green,Autumn,2011,Casual,Chhota Bheem Kids Boy I Like to be Naughty Green Tshirt
17797,Men,Apparel,Topwear,Tshirts,Blue,Autumn,2011,Casual,Chhota Bheem Kids Boy Laddoo Feast Turquoise Tshirt
17798,Men,Apparel,Topwear,Tshirts,Orange,Autumn,2011,Casual,Chhota Bheem Kids Boy Men Journey to Petra Orange Tshirt
17799,Men,Apparel,Topwear,Tshirts,Orange,Autumn,2011,Casual,Chhota Bheem Kids Boy Men Journey to Petra Orange Tshirt
17800,Women,Apparel,Topwear,Tshirts,Green,Autumn,2011,Casual,Chhota Bheem Kids Girl I Love to Play Green Tshirt
17801,Men,Apparel,Topwear,Tshirts,White,Autumn,2011,Casual,Chhota Bheem Kids Boy Power Punch White Tshirt
17802,Women,Apparel,Topwear,Tshirts,Pink,Autumn,2011,Casual,Chhota Bheem Kids Girl On The Move Pink Tshirt
17803,Women,Apparel,Topwear,Tshirts,Pink,Autumn,2011,Casual,Chhota Bheem Kids Girl  I Love to Play Pink Tshirt
17805,Men,Apparel,Topwear,Tshirts,Blue,Autumn,2011,Casual,Chhota Bheem Kids Boy Dholakpur Meri Jaan Blue Tshirt
17806,Women,Apparel,Topwear,Tshirts,White,Autumn,2011,Casual,Chhota Bheem Kids Girl Chutki Butterfly White Tshirt
17807,Boys,Apparel,Topwear,Tshirts,Rust,Autumn,2011,Casual,Chhota Bheem Kids Boys Yeh Dosthi Rust Tshirt
17808,Women,Apparel,Topwear,Tshirts,Orange,Autumn,2011,Casual,Chhota Bheem Kids Girl Chutki Flowers Orange Tshirt
17809,Men,Apparel,Topwear,Tshirts,Multi,Autumn,2011,Casual,Chhota Bheem Kids Boy Chhota Bheem and Krishna Multi Tshirt
17810,Men,Apparel,Topwear,Tshirts,Multi,Autumn,2011,Casual,Chhota Bheem Kids Boy Chhota Bheem and Krishna Multi Tshirt
17811,Men,Apparel,Topwear,Tshirts,Multi,Autumn,2011,Casual,Chhota Bheem Kids Boy Krishna Balram Multi Tshirt
18550,Women,Footwear,Shoes,Casual Shoes,Brown,Winter,2015,Casual,Catwalk Women  Brown Casual Shoes
18551,Women,Footwear,Shoes,Flats,Brown,Winter,2015,Casual,Catwalk Women  Brown Casual Shoe
18552,Women,Footwear,Shoes,Flats,Black,Winter,2015,Casual,Catwalk Women Black Shoe
18553,Women,Footwear,Shoes,Heels,Blue,Winter,2015,Casual,Catwalk Women Mary Janes Blue Flats
18554,Women,Footwear,Shoes,Heels,Beige,Winter,2015,Casual,Catwalk Women Mary Janes Beige Flats
18555,Women,Footwear,Shoes,Heels,Brown,Winter,2015,Casual,Catwalk Women Casual Brown Flats
18556,Women,Footwear,Shoes,Heels,Brown,Winter,2015,Casual,Catwalk Women Casual Brown Flats
18557,Women,Footwear,Shoes,Heels,Black,Winter,2015,Casual,Catwalk Women Casual Black Heels
18558,Women,Footwear,Shoes,Heels,Tan,Winter,2015,Casual,Catwalk Women Casual Tan Heels
18559,Women,Footwear,Shoes,Heels,Brown,Winter,2015,Casual,Catwalk Women Casual Brown Flats
18560,Women,Footwear,Shoes,Heels,Blue,Winter,2015,Casual,Catwalk Women Casual Blue Flats
18561,Women,Footwear,Shoes,Casual Shoes,Blue,Winter,2015,Casual,Catwalk Women  Blue Casual Shoe
18562,Women,Footwear,Shoes,Flats,Beige,Winter,2015,Casual,Catwalk Women Beige Casual Shoes
18564,Women,Footwear,Shoes,Flats,Teal,Winter,2015,Casual,Catwalk Women Casual Teal Sandal
20802,Men,Footwear,Shoes,Sports Shoes,White,Autumn,2010,Sports,Fila Men Racer White Sports Shoes
20804,Men,Footwear,Shoes,Sports Shoes,White,Autumn,2010,Sports,Fila Men Streak White Sports Shoes
20815,Men,Footwear,Shoes,Casual Shoes,Grey,Winter,2018,Casual,Red Tape Men Casual Grey Shoes
20816,Men,Footwear,Shoes,Formal Shoes,Black,Winter,2018,Formal,Red Tape Men Formal Black Shoes
20818,Men,Footwear,Shoes,Casual Shoes,Brown,Winter,2018,Casual,Red Tape Men Brown Leather Casual Shoes
20837,Men,Footwear,Sandal,Sandals,Olive,Spring,2012,Casual,Lee Cooper Men Casual Olive Sandals
20839,Women,Footwear,Shoes,Casual Shoes,Black,Autumn,2011,Casual,Puma Women Future Cat M1 Denim Black  Casual Shoes
20840,Men,Footwear,Sandal,Sandals,Olive,Autumn,2011,Casual,Puma Men Drifter Cat II Olive Slippers
20902,Women,Footwear,Shoes,Heels,Brown,Winter,2015,Casual,Catwalk Women Casual Brown Heels
20904,Women,Footwear,Shoes,Heels,Brown,Winter,2015,Casual,Catwalk Women  Brown Heels
20905,Women,Footwear,Shoes,Heels,Bronze,Winter,2015,Casual,Catwalk Women Casual Bronze Sandals
21175,Men,Footwear,Shoes,Sports Shoes,White,Autumn,2011,Sports,ADIDAS Men Lowell White Sports Shoe
21176,Men,Footwear,Shoes,Sports Shoes,White,Autumn,2011,Sports,ADIDAS Men Theodore White Sports Shoe
21177,Men,Footwear,Flip Flops,Flip Flops,Red,Summer,2011,Casual,ADIDAS Men Distorted Red Flip Flops
21178,Men,Footwear,Flip Flops,Flip Flops,Blue,Autumn,2010,Casual,ADIDAS Men Classroom Blue Flip Flops
21180,Men,Footwear,Flip Flops,Flip Flops,Black,Summer,2011,Casual,ADIDAS Men Adi Cells Black Flip Flops
21181,Men,Footwear,Flip Flops,Flip Flops,Yellow,Summer,2011,Casual,ADIDAS Men Adi Stars Tread Yellow Flip Flops
21182,Men,Footwear,Flip Flops,Flip Flops,Blue,Summer,2011,Casual,ADIDAS Men Adi Neo Tread Blue Flip Flops
21183,Women,Footwear,Flip Flops,Flip Flops,Blue,Autumn,2010,Casual,ADIDAS Women polka Blue Flip Flops
21184,Men,Footwear,Flip Flops,Flip Flops,Black,Spring,2012,Casual,ADIDAS Men Star Story Black Flip Flops
21185,Men,Footwear,Flip Flops,Flip Flops,White,Summer,2011,Casual,ADIDAS Men Classroom White Flip Flops
21186,Men,Footwear,Flip Flops,Flip Flops,Blue,Autumn,2011,Casual,ADIDAS Men Star Story Blue Flip Flops
21187,Men,Footwear,Flip Flops,Flip Flops,Yellow,Summer,2011,Casual,ADIDAS Men Plugged In Yellow Flip Flops
21188,Men,Footwear,Flip Flops,Flip Flops,Black,Summer,2011,Casual,ADIDAS Men Adi Stars Tread Black Flip Flops
21723,Women,Footwear,Shoes,Heels,Beige,Winter,2015,Casual,Catwalk Women Casual Beige Heels
21724,Women,Footwear,Shoes,Heels,Brown,Winter,2015,Casual,Catwalk Women Casual Brown Heels
21732,Women,Footwear,Shoes,Heels,Brown,Winter,2015,Casual,Catwalk Women Casual Brown Flats
21733,Women,Footwear,Shoes,Heels,Brown,Winter,2015,Casual,Catwalk Women Casual Brown Flats
21734,Women,Footwear,Shoes,Heels,White,Winter,2015,Casual,Catwalk Women Casual White Heels
21735,Men,Footwear,Shoes,Casual Shoes,Black,Autumn,2011,Casual,Vans Men Pro Classics Black Casual Shoes
21743,Unisex,Footwear,Shoes,Casual Shoes,Black,Spring,2012,Casual,Vans Unisex Classic Slip-On Black Casual Shoes
21744,Unisex,Footwear,Shoes,Casual Shoes,Black,Autumn,2011,Casual,Vans Unisex Classic Slip-On Black Casual Shoe
22274,Women,Footwear,Shoes,Heels,Pink,Winter,2012,Casual,Inc. 5 Women Casual Pink Flats
22275,Women,Footwear,Shoes,Heels,White,Winter,2012,Casual,Inc. 5 Women Casual White Flats
22276,Women,Footwear,Shoes,Heels,Black,Winter,2012,Casual,Inc.5 Women Black Casual Heels
22277,Women,Footwear,Shoes,Heels,Gold,Winter,2012,Casual,Inc.5 Women Gold Casual Heels
22284,Women,Footwear,Shoes,Heels,Gold,Winter,2012,Casual,Inc. 5 Women Casual Golden Heels
22289,Women,Footwear,Shoes,Heels,Gold,Winter,2012,Casual,Inc. 5 Women Casual Golden Flats
22290,Women,Footwear,Shoes,Heels,Silver,Winter,2012,Casual,Inc. 5 Women Casual Silver Flats
22294,Women,Footwear,Shoes,Heels,Beige,Winter,2012,Casual,Inc. 5 Women Casual Beige Flats
22295,Women,Footwear,Shoes,Heels,Black,Winter,2012,Casual,Inc. 5 Women Casual Black Flats
22304,Women,Footwear,Shoes,Heels,Beige,Winter,2012,Casual,Inc. 5 Women Casual Beige Heels
22305,Women,Footwear,Shoes,Heels,White,Winter,2012,Casual,Inc. 5 Women Casual White Heels
22309,Women,Footwear,Shoes,Heels,Gold,Winter,2012,Casual,Inc. 5 Women Casual Golden  Heels
22310,Women,Footwear,Shoes,Heels,Gold,Winter,2012,Casual,Inc. 5 Women Casual Golden Flats
22311,Women,Footwear,Shoes,Heels,Silver,Winter,2012,Casual,Inc. 5 Women Casual Silver Flats
22500,Women,Footwear,Shoes,Casual Shoes,Blue,Winter,2015,Casual,Catwalk Women Blue Casual Shoes
22501,Women,Footwear,Shoes,Casual Shoes,Beige,Winter,2015,Casual,Catwalk Women Beige Casual Shoes
22502,Women,Footwear,Shoes,Heels,Blue,Winter,2015,Casual,Catwalk  Women Blue Casual Flats
22524,Unisex,Footwear,Sandal,Sandals,Grey,Autumn,2011,Casual,Crocs Unisex Grey Sandals
22532,Unisex,Footwear,Sandal,Sandals,Brown,Autumn,2011,Casual,Crocs Unisex Basics khaki Slippers
22533,Unisex,Footwear,Flip Flops,Flip Flops,Brown,Summer,2015,Casual,Crocs Kids Brown Flip-Flops
22534,Unisex,Footwear,Flip Flops,Flip Flops,Red,Autumn,2015,Casual,Crocs Kids Red Flip-Flops
22536,Men,Footwear,Shoes,Casual Shoes,Green,Spring,2013,Casual,Gas Men Skate Green Casual Shoes
22537,Men,Footwear,Sandal,Sandals,Tan,Summer,2013,Casual,Gas Men Eldorado Tan Casual  Sandals
22539,Women,Footwear,Shoes,Heels,Brown,Winter,2012,Casual,Inc.5  Women Grey Flats
22544,Women,Footwear,Shoes,Heels,Orange,Winter,2012,Casual,Catwalk Women Orange Flats
22582,Men,Apparel,Topwear,Tshirts,Blue,Autumn,2011,Casual,Nike Men Blue T-shirt
22583,Men,Apparel,Topwear,Tshirts,Purple,Autumn,2011,Casual,Nike Men Purple T-shirt
22586,Boys,Apparel,Topwear,Tshirts,Blue,Autumn,2011,Sports,Nike Kids Boys Blue T-shirt
22587,Boys,Apparel,Topwear,Tshirts,Purple,Autumn,2011,Sports,Nike Kids Boys Purple T-shirt
22593,Women,Apparel,Topwear,Tshirts,Purple,Autumn,2011,Sports,Nike Women Purple T-shirt
22594,Men,Apparel,Topwear,Tshirts,Navy Blue,Autumn,2011,Sports,Nike Men Navy Blue T-shirt
22595,Men,Apparel,Topwear,Tshirts,Black,Summer,2011,Sports,Nike Men Black T-shirt
22596,Men,Apparel,Topwear,Tshirts,Red,Autumn,2011,Sports,Nike Men Red T-shirt
22597,Men,Apparel,Topwear,Tshirts,Orange,Autumn,2011,Sports,Nike Men Orange T-shirt
22598,Women,Apparel,Topwear,Tshirts,Purple,Autumn,2011,Sports,Nike Women Purple T-shirt
22599,Women,Apparel,Topwear,Tshirts,Yellow,Autumn,2011,Sports,Nike Women Yellow T-shirt
22600,Men,Apparel,Topwear,Tshirts,White,Autumn,2011,Sports,Nike Men White T-shirt
22601,Men,Apparel,Topwear,Tshirts,Grey,Autumn,2011,Sports,Nike Men Grey Polo T-shirt
22602,Men,Apparel,Topwear,Tshirts,White,Summer,2012,Sports,Nike Men White T-shirt
22603,Men,Apparel,Topwear,Tshirts,Grey,Autumn,2011,Sports,Nike Men Solid Grey T-shirt
22604,Men,Apparel,Bottomwear,Shorts,Black,Summer,2012,Sports,Nike Men Black Shorts
22607,Men,Apparel,Bottomwear,Shorts,Navy Blue,Autumn,2011,Sports,Nike Men Navy Blue Shorts
22608,Men,Apparel,Topwear,Jackets,Navy Blue,Autumn,2011,Sports,Nike Men Solid Navy Blue Jacket
22609,Women,Apparel,Topwear,Sweatshirts,Pink,Autumn,2011,Casual,Nike Women Pink Sweatshirts
22610,Men,Apparel,Topwear,Sweatshirts,Black,Summer,2012,Casual,Nike Men Black Sweatshirt
22611,Men,Apparel,Topwear,Tshirts,Green,Autumn,2011,Sports,Nike Men Green Jersey
22612,Men,Apparel,Topwear,Tshirts,Black,Autumn,2011,Sports,Nike Men Black Jersey
22613,Men,Apparel,Topwear,Tshirts,Grey,Autumn,2011,Sports,Nike Men Grey T-shirt
22614,Men,Apparel,Topwear,Tshirts,Navy Blue,Autumn,2011,Sports,Nike Men Navy Blue T-shirt
22615,Men,Apparel,Topwear,Tshirts,Grey,Summer,2011,Sports,Nike Men Grey T-shirt
22616,Men,Apparel,Topwear,Tshirts,Red,Summer,2011,Casual,Nike Men Red T-shirt
22617,Men,Apparel,Topwear,Tshirts,Black,Autumn,2011,Sports,Nike Men Black T-shirt
22618,Men,Apparel,Topwear,Tshirts,Blue,Autumn,2011,Sports,Nike Men Blue T-shirt
22619,Men,Apparel,Topwear,Tshirts,White,Autumn,2011,Sports,Nike Men White T-shirt
22620,Men,Apparel,Topwear,Tshirts,Blue,Autumn,2011,Sports,Nike Men Blue T-shirt
22621,Men,Apparel,Topwear,Tshirts,Black,Autumn,2011,Sports,Nike Men Printed Black T-shirt
22622,Men,Apparel,Topwear,Tshirts,Red,Autumn,2011,Sports,Nike Men Red Polo T-shirt
22623,Men,Apparel,Topwear,Tshirts,Grey,Autumn,2011,Sports,Nike Men Solid Grey T-shirt
22624,Men,Apparel,Topwear,Tshirts,White,Autumn,2011,Sports,Nike Men Solid White T-shirt
22625,Men,Apparel,Topwear,Sweaters,Black,Autumn,2011,Sports,Nike Men Solid Black Sweater
22626,Men,Apparel,Topwear,Sweaters,Grey,Autumn,2011,Sports,Nike Men Solid Grey Sweater
22627,Men,Apparel,Topwear,Sweaters,White,Autumn,2011,Sports,Nike Men White Sweater
22629,Men,Apparel,Topwear,Tshirts,Orange,Autumn,2011,Sports,Nike Men Orange T-shirt
22630,Women,Apparel,Topwear,Tshirts,Navy Blue,Autumn,2011,Sports,Nike Women Printed Navy Blue T-shirt
22631,Women,Apparel,Topwear,Tshirts,Pink,Autumn,2011,Sports,Nike Women Printed Pink T-shirt
22632,Men,Apparel,Topwear,Tshirts,Black,Autumn,2011,Sports,Nike Men Printed Black T-shirt
22637,Boys,Apparel,Topwear,Tshirts,Black,Autumn,2011,Casual,Nike Kids Boys Printed Black T-shirt
22638,Boys,Apparel,Topwear,Tshirts,Grey,Autumn,2011,Casual,Nike Kids Boys Printed Grey T-shirt
22639,Men,Apparel,Topwear,Tshirts,Orange,Summer,2011,Casual,Nike Men Printed Orange T-shirt
22640,Men,Apparel,Topwear,Tshirts,Navy Blue,Summer,2011,Casual,Nike Men Printed Navy Blue T-shirt
22641,Men,Apparel,Topwear,Tshirts,Black,Autumn,2011,Sports,Nike Men Solid Black T-shirt
22642,Men,Apparel,Topwear,Sweatshirts,Blue,Autumn,2011,Casual,Nike Men Printed Blue Sweatshirt
22643,Men,Apparel,Topwear,Tshirts,Yellow,Summer,2011,Casual,Nike Men Printed Yellow T-shirt
22719,Men,Footwear,Shoes,Sports Shoes,White,Autumn,2011,Sports,Nike Men Dart 9 MSL White Sports Shoes
22726,Men,Footwear,Shoes,Sports Shoes,Black,Autumn,2011,Sports,Nike Men Air Max Limitless Black Sports Shoes
22733,Men,Footwear,Shoes,Casual Shoes,Grey,Autumn,2011,Casual,Nike Men Dunk High Grey Casual Shoes
22816,Men,Footwear,Shoes,Casual Shoes,Olive,Summer,2012,Casual,Woodland Men  Olive Green Casual Shoes
22819,Men,Footwear,Shoes,Casual Shoes,Brown,Summer,2016,Casual,Woodland Men Brown Casual Shoes
22821,Men,Footwear,Shoes,Casual Shoes,Brown,Summer,2016,Sports,Woodland Men Brown Trekking Shoes
22822,Men,Footwear,Shoes,Casual Shoes,Green,Summer,2016,Casual,Woodland Men Green Shoes
22823,Men,Footwear,Shoes,Casual Shoes,Khaki,Summer,2016,Casual,Woodland Men Khaki Casual Shoes
22824,Men,Footwear,Shoes,Casual Shoes,Brown,Summer,2016,Casual,Woodland Men Brown Casual Shoes
22826,Men,Footwear,Shoes,Casual Shoes,Brown,Summer,2012,Casual,Woodland Men Brown Casual Shoes
22828,Men,Footwear,Shoes,Casual Shoes,Black,Summer,2016,Casual,Woodland Men Black Casual Shoes
22829,Men,Footwear,Shoes,Casual Shoes,Cream,Summer,2016,Casual,Woodland Men Camel Casual Shoes
22830,Men,Footwear,Shoes,Casual Shoes,Green,Summer,2016,Casual,Woodland Men Green Casual Shoes
22831,Men,Footwear,Shoes,Casual Shoes,Khaki,Summer,2016,Casual,Woodland Men Khaki Casual Shoes
22832,Men,Footwear,Shoes,Casual Shoes,Brown,Summer,2016,Casual,Woodland Men Brown Shoes
22833,Men,Footwear,Shoes,Casual Shoes,Olive,Summer,2016,Casual,Woodland Men Olive Green Casual Shoes
22836,Men,Footwear,Shoes,Casual Shoes,Brown,Summer,2012,Casual,Woodland Men Brown Casual Shoes
22837,Men,Footwear,Shoes,Casual Shoes,Cream,Summer,2012,Casual,Woodland Men Camel Casual Shoes
22838,Men,Footwear,Shoes,Casual Shoes,Khaki,Summer,2012,Casual,Woodland Men Khaki Casual Shoes
22840,Men,Footwear,Shoes,Casual Shoes,Brown,Summer,2012,Casual,Woodland Men Brown Casual Shoes
22841,Men,Footwear,Shoes,Casual Shoes,Brown,Summer,2012,Casual,Woodland Men Brown Shoes
22842,Men,Footwear,Shoes,Casual Shoes,Khaki,Summer,2012,Casual,Woodland Men Khaki Casual Shoes
22844,Men,Footwear,Shoes,Casual Shoes,Brown,Summer,2012,Casual,Woodland Men Brown Casual Shoes
22845,Men,Footwear,Shoes,Casual Shoes,Olive,Summer,2012,Casual,Woodland Men Olive Casual Shoes
22846,Men,Footwear,Shoes,Casual Shoes,Khaki,Summer,2012,Casual,Woodland Men Khaki Casual Shoes
22847,Men,Footwear,Shoes,Casual Shoes,Brown,Summer,2016,Casual,Woodland Men Camel Casual Shoes
22848,Men,Footwear,Shoes,Casual Shoes,Khaki,Summer,2016,Casual,Woodland Men Khaki Casual Shoes
22849,Men,Footwear,Shoes,Casual Shoes,Khaki,Summer,2012,Casual,Woodland Men Khaki Casual Shoes
22850,Men,Footwear,Shoes,Casual Shoes,Brown,Summer,2012,Casual,Woodland Men Brown Casual Shoes
22851,Men,Footwear,Shoes,Casual Shoes,Khaki,Summer,2012,Casual,Woodland Men Khaki Casual Shoes
22852,Men,Footwear,Shoes,Casual Shoes,Brown,Summer,2016,Casual,Woodland Men Brown Casual Shoes
22853,Men,Footwear,Shoes,Casual Shoes,Brown,Summer,2016,Casual,Woodland Men Brown Casual Shoes
22854,Men,Footwear,Shoes,Casual Shoes,Khaki,Summer,2016,Casual,Woodland Men Khaki Casual Shoes
22855,Men,Footwear,Shoes,Casual Shoes,Brown,Summer,2012,Casual,Woodland Men Brown Casual Shoes
22856,Men,Footwear,Shoes,Casual Shoes,Brown,Summer,2012,Casual,Woodland Men Brown Casual Shoes
22857,Men,Footwear,Shoes,Casual Shoes,Khaki,Summer,2012,Casual,Woodland Men Khaki Casual Shoes
22858,Men,Footwear,Shoes,Casual Shoes,Brown,Summer,2016,Casual,Woodland Men Camel Casual Shoes
22859,Men,Footwear,Shoes,Casual Shoes,Khaki,Summer,2016,Casual,Woodland Men Khaki Casual Shoes
22860,Men,Footwear,Shoes,Casual Shoes,Black,Summer,2012,Casual,Woodland Men Black Casual Shoes
22861,Men,Footwear,Shoes,Casual Shoes,Brown,Summer,2012,Casual,Woodland Men Camel Casual Shoes
22870,Men,Footwear,Shoes,Casual Shoes,Olive,Summer,2012,Casual,Woodland Men Olive Casual Shoes
22873,Men,Footwear,Shoes,Casual Shoes,Khaki,Summer,2012,Casual,Woodland Men Khaki Casual Shoes
22874,Men,Footwear,Shoes,Casual Shoes,Black,Summer,2016,Casual,Woodland Men Black Casual Shoes
22877,Men,Footwear,Shoes,Casual Shoes,Olive,Summer,2012,Casual,Woodland Men Olive Casual Shoes
22881,Men,Footwear,Sandal,Sports Sandals,Khaki,Winter,2015,Casual,Woodland Men Khaki Sports Sandals
22883,Men,Footwear,Sandal,Sandals,Khaki,Winter,2015,Casual,Woodland Men Khaki Casual Sandals
22884,Men,Footwear,Sandal,Sandals,Brown,Summer,2016,Casual,Woodland Men Brown Casual Sandals
22886,Men,Footwear,Sandal,Sandals,Khaki,Summer,2012,Casual,Woodland Men Khaki Casual Sandals
22887,Men,Footwear,Sandal,Sandals,Olive,Summer,2012,Casual,Woodland Men Olive Casual Sandals
22888,Men,Footwear,Sandal,Sandals,Brown,Summer,2012,Casual,Woodland Men Brown Casual Sandals
22889,Men,Footwear,Sandal,Sandals,Khaki,Summer,2012,Casual,Woodland Men Khaki Sandals
22890,Men,Footwear,Sandal,Sandals,Olive,Summer,2012,Casual,Woodland Men Olive Casual Sandals
22891,Men,Footwear,Sandal,Sandals,Brown,Summer,2012,Casual,Woodland Men Brown Casual Sandals
22894,Men,Footwear,Sandal,Sandals,Brown,Summer,2016,Casual,Woodland Men Camel Casual Sandals
22895,Men,Footwear,Sandal,Sandals,Khaki,Summer,2016,Casual,Woodland Men Khaki Casual Sandals
22896,Men,Footwear,Shoes,Formal Shoes,Black,Summer,2012,Formal,Woodland Men Black Formal Shoes
22911,Unisex,Footwear,Shoes,Casual Shoes,Red,Autumn,2011,Casual,Converse Unisex Plaid Check Ox Red Shoes
22912,Women,Footwear,Shoes,Casual Shoes,Black,Autumn,2011,Casual,Puma Women Future Cat Remix Black Shoes
22917,Men,Footwear,Shoes,Casual Shoes,Blue,Autumn,2011,Casual,Nike Men Blue Flyclave LTR Casual Shoes
23243,Men,Footwear,Shoes,Formal Shoes,Brown,Autumn,2011,Formal,Arrow Men Formal Brown Shoe
23244,Men,Footwear,Shoes,Formal Shoes,Black,Autumn,2011,Formal,Arrow Men Formal Black Shoes
23245,Men,Footwear,Shoes,Formal Shoes,Coffee Brown,Autumn,2011,Formal,Arrow Men Formal Coffee Brown Shoes
23247,Men,Footwear,Shoes,Formal Shoes,Black,Autumn,2011,Formal,Arrow Men Formal Black Shoe
23250,Men,Footwear,Shoes,Formal Shoes,Black,Autumn,2011,Formal,Arrow Men Formal Black Shoes
23252,Men,Footwear,Shoes,Formal Shoes,Tan,Autumn,2011,Formal,Arrow Men Formal Tan Shoe
23254,Men,Footwear,Shoes,Formal Shoes,Brown,Autumn,2011,Formal,Arrow Men Formal Brown Shoes
26306,Men,Apparel,Topwear,Tshirts,Grey,Autumn,2013,Casual,Proline Men Pack of 3 T-Shirts
26788,Men,Apparel,Topwear,Shirts,Brown,Summer,2012,Formal,Arrow Men Brown Shirt
26789,Men,Apparel,Topwear,Shirts,Blue,Summer,2012,Formal,Arrow Men Blue Shirt
26793,Men,Apparel,Topwear,Shirts,Lavender,Summer,2013,Formal,Arrow Men Lavender Shirt
26794,Men,Apparel,Topwear,Shirts,Grey,Summer,2013,Formal,Arrow Men Grey Shirt
26796,Men,Apparel,Topwear,Shirts,Blue,Summer,2013,Formal,Arrow Men Blue Striped Shirt
26797,Men,Apparel,Topwear,Shirts,Grey,Summer,2013,Formal,Arrow Men Grey Striped Shirt
26803,Men,Apparel,Topwear,Shirts,Maroon,Summer,2013,Formal,Arrow Men Maroon Striped Slim Fit Shirt
26804,Men,Apparel,Topwear,Shirts,Black,Summer,2013,Formal,Arrow Men Black Striped Slim Fit Shirt
26813,Men,Apparel,Topwear,Shirts,Grey,Summer,2012,Formal,Arrow Men Grey Striped Shirt
26814,Men,Apparel,Topwear,Shirts,Blue,Summer,2012,Formal,Arrow Men Blue Striped Shirt
27193,Women,Footwear,Shoes,Heels,Blue,Winter,2015,Casual,Catwalk Women Blue Flats
27194,Women,Footwear,Shoes,Heels,Yellow,Winter,2015,Casual,Catwalk Women Yellow Flats
27195,Women,Apparel,Dress,Dresses,Off White,Summer,2012,Casual,Doodle Kids Girl Printed Off White Dress
27196,Girls,Apparel,Dress,Dresses,Yellow,Summer,2012,Casual,Doodle Girls Yellow Dress
27197,Women,Apparel,Dress,Dresses,Pink,Summer,2012,Casual,Doodle Kids Girl Pink Dress
27198,Women,Apparel,Dress,Dresses,Blue,Summer,2012,Casual,Doodle Kids Girl Printed Blue Dress
27199,Women,Apparel,Bottomwear,Skirts,Grey,Summer,2012,Casual,Doodle Kids Girl Printed Grey Skirt
27202,Men,Apparel,Topwear,Shirts,Red,Summer,2012,Casual,Doodle Kids Boy Check Red Shirt
27203,Men,Apparel,Bottomwear,Jeans,Blue,Summer,2012,Casual,Doodle Kids Boy  Blue Jeans
27204,Men,Apparel,Bottomwear,Jeans,Blue,Summer,2012,Casual,Doodle Kids Boy Washed Blue Jeans
27205,Men,Apparel,Bottomwear,Shorts,Blue,Summer,2012,Casual,Doodle Kids Boy Dark Blue Shorts
27206,Men,Apparel,Bottomwear,Shorts,Blue,Summer,2012,Casual,Doodle Kids Boy Light Blue Shorts
27207,Men,Apparel,Bottomwear,Shorts,White,Summer,2012,Casual,Doodle Kids Boy  White Shorts
27208,Men,Apparel,Bottomwear,Shorts,Beige,Summer,2012,Casual,Doodle Kids Boy  Beige Shorts
27209,Men,Apparel,Topwear,Shirts,Red,Summer,2012,Casual,Doodle Kids Boy Check Red Shirt
27210,Men,Apparel,Topwear,Shirts,Green,Summer,2012,Casual,Doodle Kids Boy Check Green Shirt
27211,Men,Apparel,Topwear,Shirts,Purple,Summer,2012,Casual,Doodle Kids Boy Check Purple Shirt
27212,Men,Apparel,Topwear,Shirts,Blue,Summer,2012,Casual,Doodle Kids Boy Striped Blue Shirt
27213,Men,Apparel,Topwear,Shirts,Blue,Summer,2012,Casual,Doodle Kids Boy Check Blue Shirt
27214,Men,Apparel,Bottomwear,Shorts,Brown,Summer,2012,Casual,Doodle Kids Boy  Brown Shorts
27215,Men,Apparel,Bottomwear,Shorts,Blue,Summer,2012,Casual,Doodle Kids Boy Striped Blue Shorts
27216,Men,Apparel,Bottomwear,Shorts,Navy Blue,Summer,2012,Casual,Doodle Kids Boy  Navy Blue Shorts
27217,Men,Apparel,Bottomwear,Shorts,Beige,Summer,2012,Casual,Doodle Kids Boy  Beige Shorts
27218,Men,Apparel,Bottomwear,Shorts,Blue,Summer,2012,Casual,Doodle Kids Boy Printed Blue Shorts
27219,Women,Apparel,Dress,Dresses,Lavender,Summer,2012,Casual,Doodle Kids Girl Printed Lavender Dress
27220,Women,Apparel,Topwear,Tops,Purple,Summer,2012,Casual,Doodle Kids Girl Printed Purple Top
27221,Women,Apparel,Topwear,Tops,Pink,Summer,2012,Casual,Doodle Kids Girl Striped Pink Top
27222,Women,Apparel,Bottomwear,Capris,Pink,Summer,2012,Casual,Doodle Kids Girl  Pink Capris
27223,Women,Apparel,Dress,Dresses,Blue,Summer,2012,Casual,Doodle Kids Girl Printed Blue Dress
27224,Women,Apparel,Dress,Dresses,White,Summer,2012,Casual,Doodle Kids Girl Printed White Dress
27225,Girls,Apparel,Dress,Dresses,Pink,Summer,2012,Casual,Doodle Girls Printed Pink Dress
27226,Women,Apparel,Dress,Dresses,Pink,Summer,2012,Casual,Doodle Kids Girl Printed Pink Dress
