id,gender,masterCategory,subCategory,articleType,baseColour,season,year,usage,productDisplayName
10756,Women,Footwear,Shoes,Casual Shoes,Red,Winter,2012,Casual,Disney Kids Welding Red Casual Shoes
10757,Unisex,Footwear,Flip Flops,Flip Flops,Pink,Winter,2012,Casual,Disney Unisex Kids Princess Heart Pink Flip Flops
10758,Girls,Footwear,Shoes,Casual Shoes,Blue,Winter,2012,Casual,Disney Kids Girls Princess Heart Blue Casual Shoes
10759,Unisex,Footwear,Flip Flops,Flip Flops,Pink,Winter,2012,Casual,Disney Unisex Kids Mini Mouse Pink Flip Flops
10760,Unisex,Footwear,Flip Flops,Flip Flops,Red,Winter,2012,Casual,Disney Unisex Kids Basic Red Flip Flops
10761,Unisex,Footwear,Flip Flops,Flip Flops,Red,Winter,2012,Casual,Disney Unisex Kids Basic Red Flip Flops
10762,Unisex,Footwear,Flip Flops,Flip Flops,Yellow,Winter,2012,Casual,Disney Unisex Kids Basic Yellow Flip Flops
10765,Unisex,Footwear,Flip Flops,Flip Flops,Navy Blue,Winter,2012,Casual,Disney Unisex Kids Basic Navy Blue Flip Flops
10766,Unisex,Footwear,Flip Flops,Flip Flops,Yellow,Winter,2012,Casual,Disney Unisex Kids Basic Yellow Flip Flops
10767,Unisex,Footwear,Flip Flops,Flip Flops,White,Winter,2012,Casual,Disney Unisex Kids Basic White Flip Flops
10768,Unisex,Footwear,Flip Flops,Flip Flops,Pink,Winter,2012,Casual,Disney Unisex Kids Basic Pink Flip Flops
10769,Unisex,Footwear,Flip Flops,Flip Flops,White,Winter,2012,Casual,Disney Unisex Kids Basic White Flip Flops
10770,Girls,Footwear,Shoes,Casual Shoes,Red,Winter,2012,Casual,Disney Kids Red Casual Shoes
10771,Girls,Footwear,Shoes,Casual Shoes,Red,Winter,2012,Casual,Disney Kids Red Casual Shoes
10772,Boys,Footwear,Shoes,Casual Shoes,Navy Blue,Winter,2012,Casual,Disney Kids Navy Blue Casual Shoes
10776,Men,Apparel,Topwear,Tshirts,Red,Summer,2011,Sports,Nike Men Athletic Red Tshirts
10777,Women,Apparel,Topwear,Jackets,Purple,Summer,2011,Sports,Nike Women Hooded Purple Jacket
10778,Men,Apparel,Bottomwear,Shorts,Navy Blue,Summer,2011,Sports,Nike Men Training Navy Blue Shorts
10783,Men,Footwear,Shoes,Sports Shoes,White,Autumn,2011,Sports,New Balance M364 Men Others Xtraining White Sports Shoes
11260,Women,Apparel,Bottomwear,Skirts,Green,Summer,2011,Casual,Palm Tree Kids Girl Sp Jace Sko Green Skirts
11261,Women,Apparel,Dress,Dresses,Red,Summer,2011,Casual,Palm Tree Kids Girls Red Saloppette Set
11269,Men,Apparel,Topwear,Tshirts,Black,Autumn,2011,Sports,Nike Men Laced Crew Black T-Shirts
11270,Men,Apparel,Topwear,Tshirts,Maroon,Autumn,2011,Sports,Nike Men As Ss Cruiser Maroon T-Shirts
11272,Men,Apparel,Topwear,Tshirts,Red,Autumn,2011,Sports,Nike Men Cricket Red Tshirt
11273,Men,Apparel,Topwear,Jackets,Blue,Autumn,2011,Casual,Nike Men  Blue Jacket
11274,Men,Apparel,Bottomwear,Track Pants,Black,Autumn,2011,Sports,Nike Men Crickt Black Track Pants
11275,Men,Apparel,Bottomwear,Track Pants,Black,Autumn,2011,Sports,Nike Men Crickt Black Track Pants
11276,Men,Apparel,Topwear,Sweatshirts,Maroon,Autumn,2011,Sports,Nike Men Running Maroon Sweatshirt
11277,Men,Apparel,Bottomwear,Track Pants,Blue,Autumn,2011,Sports,Nike Men Crickt Blue Track Pants
11492,Women,Footwear,Shoes,Heels,Brown,Winter,2015,Casual,Catwalk Women Bronze Brown Wedges
11493,Women,Footwear,Shoes,Heels,Pink,Winter,2015,Casual,Catwalk Women Lifestyle Pink Wedges
11495,Women,Footwear,Shoes,Flats,Grey,Winter,2015,Casual,Catwalk Women Gun Metal Grey Ballerinas
11496,Women,Footwear,Shoes,Heels,Grey,Winter,2015,Casual,Catwalk Women Gun Metal Grey Flats
11497,Women,Footwear,Shoes,Heels,Pink,Winter,2015,Casual,Catwalk Women Lifestyle Pink Flats
11498,Women,Footwear,Shoes,Heels,White,Winter,2015,Casual,Catwalk Women Lifestyle White Heels
11499,Women,Footwear,Shoes,Heels,Blue,Winter,2015,Casual,Catwalk Women Lifestyle Blue Flats
11500,Women,Footwear,Shoes,Heels,Black,Winter,2015,Casual,Catwalk Women Lifestyle Black Heels
11502,Women,Footwear,Shoes,Heels,Silver,Winter,2015,Casual,Catwalk Women Lifestyle Silver Flats
11503,Women,Footwear,Shoes,Heels,Blue,Spring,2013,Casual,Catwalk Women Lifestyle Blue Flats
11504,Women,Footwear,Shoes,Flats,Black,Winter,2015,Casual,Catwalk Women Black Flats
11505,Women,Footwear,Shoes,Heels,Black,Winter,2015,Casual,Catwalk Women Lifestyle Black Flats
11506,Women,Footwear,Shoes,Heels,Grey,Winter,2015,Casual,Catwalk Women Lifestyle Grey Flats
11507,Women,Footwear,Shoes,Heels,Brown,Winter,2015,Casual,Catwalk Women Lifestyle Brown Flats
11508,Women,Footwear,Shoes,Heels,Black,Winter,2015,Casual,Catwalk Women Lifestyle Black Heels
11509,Women,Footwear,Shoes,Flats,Tan,Winter,2015,Casual,Catwalk Women Lifestyle Tan Flats
11510,Women,Footwear,Shoes,Heels,Beige,Winter,2015,Casual,Catwalk Women Lifestyle Beige Flats
11511,Women,Footwear,Shoes,Flats,Gold,Winter,2015,Casual,Catwalk Women Lifestyle Gold Toned Ballerinas
11512,Women,Footwear,Shoes,Heels,Brown,Winter,2015,Casual,Catwalk Women Bronze Brown Wedges
11513,Women,Footwear,Shoes,Heels,Blue,Winter,2015,Casual,Catwalk Women Lifestyle Blue Flats
11514,Women,Footwear,Shoes,Heels,Black,Winter,2015,Casual,Catwalk Women Lifestyle Black Heels
11515,Women,Footwear,Shoes,Heels,Black,Winter,2015,Casual,Catwalk Women Lifestyle Black Heels
11516,Women,Footwear,Shoes,Heels,Black,Winter,2015,Casual,Catwalk Women Lifestyle Black Heels
11517,Women,Footwear,Shoes,Heels,White,Winter,2015,Casual,Catwalk Women Lifestyle White Shoes
11518,Women,Footwear,Shoes,Heels,Grey,Winter,2015,Casual,Catwalk Women Gun Metal Grey Heels
11519,Women,Footwear,Shoes,Heels,Brown,Winter,2015,Casual,Catwalk Women Bronze Brown Heels
11870,Men,Footwear,Shoes,Formal Shoes,Brown,Autumn,2011,Formal,Franco Leone Men Formal Brown Formal Shoes
11871,Men,Footwear,Shoes,Formal Shoes,Black,Summer,2013,Formal,Franco Leone Men Formal Black Formal Shoes
11872,Men,Footwear,Shoes,Formal Shoes,Black,Summer,2012,Formal,Franco Leone Men Formal Black Formal Shoes
11873,Men,Footwear,Shoes,Formal Shoes,Black,Summer,2011,Formal,Franco Leone Men Formal Black Formal Shoes
11874,Men,Footwear,Shoes,Formal Shoes,Black,Summer,2013,Casual,Franco Leone Men Casual Black Sandals
11875,Men,Footwear,Shoes,Formal Shoes,Brown,Summer,2013,Casual,Franco Leone Men Casual Brown Sandals
11876,Men,Footwear,Sandal,Sandals,Black,Summer,2012,Casual,Franco Leone Men Casual Black Sandals
11877,Men,Footwear,Sandal,Sandals,Brown,Summer,2012,Casual,Franco Leone Men Casual Brown Sandals
11878,Men,Footwear,Shoes,Formal Shoes,Black,Summer,2012,Formal,Franco Leone Men Formal Black Formal Shoes
11879,Men,Footwear,Shoes,Formal Shoes,Black,Summer,2013,Formal,Franco Leone Men Formal Black Formal Shoes
11880,Men,Footwear,Shoes,Formal Shoes,Black,Autumn,2011,Formal,Franco Leone Men Formal Black Formal Shoes
11881,Men,Footwear,Shoes,Formal Shoes,Brown,Autumn,2011,Formal,Franco Leone Men Formal Brown Formal Shoes
11882,Men,Footwear,Shoes,Formal Shoes,Black,Autumn,2011,Formal,Franco Leone Men Formal Black Formal Shoes
11883,Men,Footwear,Shoes,Formal Shoes,Black,Autumn,2011,Formal,Franco Leone Men Formal Black Formal Shoes
11884,Men,Footwear,Shoes,Formal Shoes,Black,Winter,2015,Formal,Franco Leone Men Black Formal Shoes
11885,Men,Footwear,Shoes,Formal Shoes,Blue,Summer,2011,Formal,Franco Leone Men Formal Blue Formal Shoes
11886,Men,Footwear,Shoes,Formal Shoes,Black,Summer,2011,Formal,Franco Leone Men Formal Black Formal Shoes
11887,Men,Footwear,Shoes,Formal Shoes,Black,Summer,2012,Formal,Franco Leone Men Formal Black Formal Shoes
11888,Men,Footwear,Shoes,Formal Shoes,Black,Summer,2013,Formal,Franco Leone Men Black Semi-Formal Shoes
11889,Men,Footwear,Shoes,Formal Shoes,Tan,Summer,2013,Formal,Franco Leone Men Formal Tan Formal Shoes
11890,Men,Footwear,Shoes,Formal Shoes,Black,Summer,2013,Formal,Franco Leone Men Formal Black Formal Shoes
11891,Men,Footwear,Shoes,Formal Shoes,Tan,Summer,2012,Formal,Franco Leone Men Formal Tan Formal Shoes
11892,Men,Footwear,Shoes,Formal Shoes,Black,Summer,2013,Formal,Franco Leone Men Formal Black Formal Shoes
11893,Men,Footwear,Sandal,Sandals,Black,Summer,2013,Casual,Franco Leone Men Casual Black Sandals
11894,Men,Footwear,Sandal,Sandals,Tan,Summer,2013,Casual,Franco Leone Men Casual Tan Sandals
11895,Men,Footwear,Shoes,Formal Shoes,Black,Autumn,2011,Formal,Franco Leone Men Formal Black Formal Shoes
11896,Men,Footwear,Shoes,Formal Shoes,Black,Summer,2011,Formal,Franco Leone Men Formal Black Formal Shoes
11897,Men,Footwear,Shoes,Formal Shoes,Brown,Autumn,2011,Formal,Franco Leone Men Formal Brown Formal Shoes
11898,Men,Footwear,Shoes,Formal Shoes,Black,Summer,2012,Formal,Franco Leone Men Formal Black Formal Shoes
11905,Men,Footwear,Sandal,Sandals,Black,Autumn,2012,Casual,Franco Leone Men Casual Black Sandals
11912,Men,Footwear,Sandal,Sandals,Maroon,Summer,2011,Casual,Franco Leone Men Casual Maroon Sandals
11914,Men,Footwear,Sandal,Sandals,Black,Summer,2014,Casual,Franco Leone Men Casual Black Sandals
11918,Men,Footwear,Sandal,Sandals,Black,Summer,2011,Casual,Franco Leone Men Casual Black Sandals
11919,Men,Footwear,Sandal,Sandals,Brown,Summer,2011,Formal,Franco Leone Men Casual Brown Sandals
11920,Men,Footwear,Shoes,Formal Shoes,Black,Winter,2015,Formal,Franco Leone Men Formal Black Shoe
11921,Men,Footwear,Shoes,Formal Shoes,Brown,Winter,2015,Formal,Franco Leone Men Brown Leather Formal Shoes
11922,Men,Footwear,Shoes,Formal Shoes,Black,Summer,2012,Formal,Franco Leone Men Formal Black Formal Shoes
11924,Men,Footwear,Shoes,Formal Shoes,Black,Summer,2013,Formal,Franco Leone Men Black Formal Shoes
11925,Women,Footwear,Shoes,Flats,Black,Winter,2015,Casual,Skechers Women Tone Black Sandals
11942,Men,Footwear,Sandal,Sandals,Black,Summer,2011,Casual,Ganuchi Men Casual Black Sandals
11944,Men,Footwear,Sandal,Sandals,Blue,Summer,2012,Casual,Ganuchi Men Casual Blue Sandals
11945,Men,Footwear,Sandal,Sandals,Red,Summer,2012,Casual,Ganuchi Men Casual Red Sandals
11946,Men,Footwear,Sandal,Sandals,Brown,Summer,2012,Casual,Ganuchi Men Casual Brown Sandals
11957,Men,Footwear,Shoes,Casual Shoes,Tan,Summer,2012,Casual,Ganuchi Men Casual Tan Casual Shoes
11958,Men,Footwear,Shoes,Casual Shoes,Black,Autumn,2012,Casual,Ganuchi Men Casual Black Casual Shoes
11962,Men,Footwear,Sandal,Sandals,Black,Autumn,2012,Casual,Ganuchi Men Casual Black Slipper
11963,Men,Footwear,Sandal,Sandals,Brown,Autumn,2012,Casual,Ganuchi Men Brown Sandals
11964,Men,Footwear,Sandal,Sandals,Black,Autumn,2011,Casual,Ganuchi Men Casual Black Slipper
11965,Men,Footwear,Sandal,Sandals,Black,Autumn,2012,Casual,Ganuchi Men Grey Sandals
11966,Unisex,Footwear,Shoes,Sports Shoes,Yellow,Spring,2012,Sports,Newfeel Unisex Sports Yellow Sports Shoes
12508,Men,Footwear,Shoes,Casual Shoes,Brown,Winter,2018,Casual,Red Tape Men Casual Brown Casual Shoes
12509,Men,Footwear,Shoes,Casual Shoes,Brown,Winter,2018,Casual,Red Tape Men Casual Brown Casual Shoes
12515,Men,Footwear,Shoes,Casual Shoes,Black,Winter,2018,Casual,Red Tape Men Black Shoes
12516,Men,Footwear,Shoes,Formal Shoes,Black,Winter,2018,Formal,Red Tape Men Formal Black Formal Shoes
12522,Men,Footwear,Shoes,Casual Shoes,Brown,Winter,2018,Casual,Red Tape Men Brown Shoes
12523,Girls,Footwear,Sandal,Sandals,Blue,Autumn,2011,Casual,Crocs Kids Girl's Casual Blue Sandals
12582,Unisex,Apparel,Topwear,Tshirts,White,Autumn,2011,Casual,Tantra Unisex Printed White Tshirts
12583,Unisex,Apparel,Topwear,Tshirts,Green,Autumn,2011,Casual,Tantra Unisex Printed Green Tshirts
12584,Unisex,Apparel,Topwear,Tshirts,Green,Autumn,2011,Casual,Tantra Unisex Printed Green Tshirts
12585,Unisex,Apparel,Topwear,Tshirts,Blue,Autumn,2011,Casual,Tantra Unisex Printed Blue Tshirts
12586,Unisex,Apparel,Topwear,Tshirts,Pink,Autumn,2011,Casual,Tantra Unisex Printed Pink Tshirts
12587,Unisex,Apparel,Topwear,Tshirts,Brown,Autumn,2011,Casual,Tantra Unisex Printed Brown Tshirts
12588,Unisex,Apparel,Topwear,Tshirts,Blue,Autumn,2011,Casual,Tantra Unisex Printed Blue Tshirts
12589,Unisex,Apparel,Topwear,Tshirts,Brown,Autumn,2011,Casual,Tantra Unisex Printed Brown Tshirts
12590,Unisex,Apparel,Topwear,Tshirts,White,Autumn,2011,Casual,Tantra Unisex Printed White Tshirts
12591,Unisex,Apparel,Topwear,Tshirts,Blue,Autumn,2011,Casual,Tantra Unisex Printed Blue Tshirts
12592,Unisex,Apparel,Topwear,Tshirts,Green,Autumn,2011,Casual,Tantra Unisex Printed Green Tshirts
12593,Unisex,Apparel,Topwear,Tshirts,Blue,Autumn,2011,Casual,Tantra Unisex Printed Blue Tshirts
12594,Unisex,Apparel,Topwear,Tshirts,Blue,Autumn,2011,Casual,Tantra Unisex Printed Blue Tshirts
12595,Unisex,Apparel,Topwear,Tshirts,Black,Autumn,2011,Casual,Tantra Unisex Printed Black Tshirts
12597,Unisex,Apparel,Topwear,Tshirts,White,Autumn,2011,Casual,Tantra Unisex Printed White Tshirts
12598,Unisex,Apparel,Topwear,Tshirts,Orange,Autumn,2011,Casual,Tantra Unisex Printed Orange Tshirts
12599,Unisex,Apparel,Topwear,Tshirts,Green,Autumn,2011,Casual,Tantra Unisex Printed Green Tshirts
12600,Unisex,Apparel,Topwear,Tshirts,Black,Autumn,2011,Casual,Tantra Unisex Printed Black Tshirts
12601,Unisex,Apparel,Topwear,Tshirts,Red,Autumn,2011,Casual,Tantra Unisex Printed Red Tshirts
12602,Unisex,Apparel,Topwear,Tshirts,Green,Autumn,2011,Casual,Tantra Unisex Printed Green Tshirts
12603,Unisex,Apparel,Topwear,Tshirts,Red,Autumn,2011,Casual,Tantra Unisex Printed Red Tshirts
12683,Women,Footwear,Shoes,Sports Shoes,White,Autumn,2011,Sports,Fila Women Elixir Low White Shoes
12685,Men,Footwear,Shoes,Casual Shoes,Black,Autumn,2011,Casual,Fila Men Vintage Hi Black Casual Shoes
12688,Unisex,Footwear,Sandal,Sandals,Black,Autumn,2011,Casual,Fila Unisex Opera Black Slippers
12693,Women,Footwear,Shoes,Sports Shoes,White,Summer,2012,Sports,Nike Women Transform White Sports Shoes
12694,Men,Footwear,Shoes,Sports Shoes,White,Autumn,2011,Sports,Nike Men Atlntc Bl White Sports Shoes
12695,Men,Footwear,Shoes,Sports Shoes,Black,Autumn,2011,Sports,Nike Men Air Press Black Sports Shoes
12696,Men,Footwear,Shoes,Sports Shoes,White,Autumn,2011,Sports,Nike Men Transform White Sports Shoes
12697,Men,Footwear,Shoes,Sports Shoes,White,Autumn,2011,Sports,Nike Men Egoli TF White Sports Shoes
12700,Men,Footwear,Shoes,Sports Shoes,Black,Autumn,2011,Sports,Nike Men Metallic Gold Black Sports Shoes
12701,Women,Footwear,Shoes,Sports Shoes,Blue,Autumn,2011,Sports,Nike Women Lunarfly Blue Sports Shoes
12702,Women,Footwear,Shoes,Casual Shoes,White,Autumn,2011,Casual,Nike Women Capri White Casual Shoes
12704,Men,Footwear,Shoes,Sports Shoes,Grey,Autumn,2011,Sports,Nike Men Air Relentness Grey Sports Shoes
12706,Men,Footwear,Shoes,Sports Shoes,White,Autumn,2011,Sports,Nike Men Deep Red White Sports Shoes
12708,Men,Footwear,Shoes,Sports Shoes,White,Autumn,2011,Sports,Nike Men Lunareclipse White Sports Shoes
12709,Men,Footwear,Shoes,Sports Shoes,Grey,Autumn,2011,Sports,Nike Men Air Impetus Grey Sports Shoes
12711,Women,Footwear,Shoes,Sports Shoes,Grey,Autumn,2011,Sports,Nike Women Lunarshift Grey Sports Shoes
12716,Men,Footwear,Shoes,Sports Shoes,Grey,Autumn,2011,Sports,Nike Men Air Visi Pro Grey Sports Shoes
12718,Men,Footwear,Shoes,Sports Shoes,White,Autumn,2011,Sports,Nike Men Air Impetus II White Sports Shoes
12719,Women,Footwear,Shoes,Flats,Green,Autumn,2011,Casual,Nike Women Butterfly Thong Green Flip Flops
12720,Unisex,Footwear,Sandal,Sandals,Black,Autumn,2011,Casual,ADIDAS Unisex Casual Black Sandals
12721,Unisex,Footwear,Sandal,Sandals,Black,Autumn,2011,Casual,ADIDAS Unisex Casual Black Sandals
12722,Unisex,Footwear,Sandal,Sandals,Brown,Autumn,2011,Casual,ADIDAS Unisex Casual Brown Sandals
12723,Men,Footwear,Shoes,Sports Shoes,White,Autumn,2011,Sports,ADIDAS Men Streak White Sports Shoes
12724,Men,Footwear,Shoes,Casual Shoes,Black,Autumn,2011,Casual,ADIDAS Men Treklite Black Casual Shoes
12725,Men,Footwear,Shoes,Casual Shoes,Brown,Autumn,2011,Casual,ADIDAS Men Anzo Breeze Brown Casual Shoes
12790,Men,Apparel,Topwear,Tshirts,Red,Summer,2012,Sports,Nike Men Arsenal Red Jersey
12791,Men,Apparel,Topwear,Tshirts,Red,Autumn,2011,Sports,Nike Men Manchester United Red Jerseys
12792,Men,Apparel,Topwear,Tshirts,Black,Autumn,2011,Sports,Nike Men Manchester United Black Jersey
12793,Women,Apparel,Topwear,Tshirts,Maroon,Autumn,2011,Casual,Nike Women Blue Grafitti Maroon Tshirts
12794,Women,Apparel,Topwear,Tshirts,Pink,Autumn,2011,Casual,Nike Women White Print Pink Tshirts
12795,Men,Apparel,Topwear,Tshirts,Yellow,Autumn,2011,Casual,Nike Men Brazil Yellow Tshirts
12796,Women,Apparel,Topwear,Tshirts,Black,Autumn,2011,Casual,Nike Women Grafitti Black T-shirt
12797,Men,Apparel,Topwear,Tshirts,Black,Autumn,2011,Sports,Nike Men The Red Devils Black Tshirts
12798,Men,Apparel,Topwear,Tshirts,Navy Blue,Autumn,2011,Sports,Nike Men Arsenal Navy Blue Jersey
12799,Men,Apparel,Topwear,Tshirts,Blue,Autumn,2011,Sports,Nike Men Blue Manchester United Jersey
12800,Men,Apparel,Topwear,Tshirts,Grey,Autumn,2011,Sports,Nike Men Basketball Jersey Grey Jerseys
12801,Men,Apparel,Topwear,Tshirts,Red,Autumn,2011,Sports,Nike Men Red Manchester United Jersey
12802,Women,Apparel,Topwear,Tshirts,Green,Autumn,2011,Casual,Nike Women Flower Green Tshirts
12803,Women,Apparel,Topwear,Tshirts,Pink,Autumn,2011,Casual,Nike Women Polka Dot Grafitti Pink T-shirt
12804,Men,Apparel,Topwear,Tshirts,Green,Autumn,2011,Casual,Nike Men Green Polo Tshirts
12805,Men,Apparel,Topwear,Tshirts,Grey,Autumn,2011,Casual,Nike Men Grey Polo Tshirts
12806,Men,Apparel,Topwear,Sweatshirts,Grey,Autumn,2011,Sports,Nike Men Zip Grey Sweatshirts
12807,Women,Apparel,Topwear,Jackets,Pink,Autumn,2011,Sports,Nike Women Hood Pink Jackets
12808,Men,Apparel,Topwear,Jackets,Blue,Autumn,2011,Sports,Nike Men Zip Pocket Blue Jackets
12809,Men,Apparel,Topwear,Jackets,Black,Autumn,2011,Sports,Nike Men Hood Black Jacket
12810,Women,Apparel,Bottomwear,Track Pants,Black,Autumn,2011,Sports,Nike Women Trainng Black Track Pants
12811,Men,Apparel,Bottomwear,Track Pants,Black,Summer,2012,Sports,Nike Men Dri-Fit Black Track Pants
12812,Men,Apparel,Bottomwear,Shorts,Black,Summer,2012,Sports,Nike Men Football/Soccer Black Shorts
12813,Men,Footwear,Shoes,Casual Shoes,White,Autumn,2011,Casual,Nike Men Sports White Casual Shoes
12814,Unisex,Footwear,Shoes,Casual Shoes,Navy Blue,Autumn,2011,Casual,Puma Unisex 917 Lo Navy Blue Casual Shoes
12816,Men,Footwear,Shoes,Casual Shoes,Black,Autumn,2011,Casual,Fila Men Driving Velcro Black Casual Shoes
12817,Men,Footwear,Sandal,Sandals,Grey,Autumn,2011,Casual,Puma Men Snipper Grey Sandals
12819,Men,Footwear,Shoes,Sports Shoes,White,Autumn,2011,Sports,Nike Men Air Impetus White Shoes
12820,Unisex,Footwear,Flip Flops,Flip Flops,Red,Autumn,2011,Casual,Puma Unisex Surf Red Slippers
12821,Women,Footwear,Shoes,Casual Shoes,Blue,Autumn,2011,Casual,Puma Women Karlie Blur Wn's Dazzling Blue Casual Shoes
12822,Men,Footwear,Sandal,Sandals,Black,Autumn,2011,Casual,Puma Men Snipper Black Sandals
12823,Men,Footwear,Shoes,Casual Shoes,Yellow,Autumn,2011,Casual,Lotto Men Dynamo Yellow Casual Shoes
12824,Women,Footwear,Shoes,Casual Shoes,Black,Autumn,2011,Casual,Nike Women Flyclave Black Casual Shoes
12825,Unisex,Footwear,Flip Flops,Flip Flops,Black,Autumn,2011,Casual,Puma Unisex Coral Black Slippers
12830,Women,Apparel,Dress,Dresses,Green,Autumn,2011,Casual,Ant Kids Peaceful Day Green Dresses
12831,Women,Apparel,Topwear,Tops,Pink,Autumn,2011,Casual,Ant Kids Pink Tops
12832,Men,Apparel,Topwear,Tshirts,Blue,Autumn,2011,Casual,Ant Kids I Ate Blue Tshirts
12833,Men,Apparel,Topwear,Tshirts,Green,Autumn,2011,Casual,Ant Kids Spirit Green Tshirts
12834,Unisex,Apparel,Topwear,Tshirts,Blue,Autumn,2011,Casual,Ant Unisex Cute Chick Blue Tshirts
12835,Women,Apparel,Dress,Dresses,Orange,Autumn,2011,Casual,Ant Kids Flower Orange Dresses
12836,Men,Apparel,Topwear,Tshirts,Green,Autumn,2011,Casual,Ant Kids Tennis Green T-Shirt
12837,Women,Apparel,Dress,Dresses,Pink,Autumn,2011,Casual,Ant Kids Button Bow Pink Dresses
12838,Unisex,Apparel,Topwear,Tshirts,White,Autumn,2011,Casual,Ant Unisex Bebo White Tshirts
12839,Women,Apparel,Bottomwear,Skirts,Black,Autumn,2011,Casual,Ant Kids Pleated Black Skirts
12840,Boys,Apparel,Topwear,Tshirts,Brown,Autumn,2011,Casual,Ant Kids Brown Striped T-Shirt
12841,Men,Apparel,Topwear,Tshirts,Grey,Autumn,2011,Casual,Ant Kids Multi Colour Grey Tshirts
12842,Men,Apparel,Topwear,Tshirts,Navy Blue,Autumn,2011,Casual,Ant Kids Warrior Kids Navy Blue Tshirts
12843,Men,Apparel,Topwear,Tshirts,Navy Blue,Autumn,2011,Casual,Ant Kids Keep Up Navy Blue Tshirts
12844,Boys,Apparel,Topwear,Tshirts,Multi,Autumn,2011,Casual,Ant Kids Boys Multicoloured Striped T-shirts
12845,Boys,Apparel,Topwear,Tshirts,Maroon,Autumn,2011,Casual,Ant Kids Boys Arrow Maroon Tshirts
12846,Boys,Apparel,Topwear,Tshirts,Grey,Autumn,2011,Casual,Ant Kids Boys Rock Grey Tshirts
12847,Boys,Apparel,Topwear,Tshirts,Black,Autumn,2011,Casual,Ant Kids Boys National Champion Black Tshirts
12848,Women,Apparel,Bottomwear,Skirts,Blue,Autumn,2011,Casual,Ant Kids Check Blue Skirts
12849,Girls,Apparel,Dress,Dresses,White,Autumn,2011,Casual,Ant Kids Girls Butterfly Print White Dresses
12850,Women,Apparel,Topwear,Tops,Green,Autumn,2011,Casual,Ant Kids Girl Cheerful Green Tops
12851,Women,Apparel,Topwear,Tops,Black,Autumn,2011,Casual,Ant Kids Crystal Button Black Tops
12852,Men,Apparel,Topwear,Shirts,Green,Autumn,2011,Casual,Ant Kids Pocket Button Green Shirts
12853,Men,Footwear,Shoes,Formal Shoes,Black,Autumn,2012,Formal,Lee Cooper Men Formal Black Shoes
12854,Men,Footwear,Shoes,Formal Shoes,Black,Spring,2012,Formal,Lee Cooper Men Formal Black Shoes
12855,Men,Footwear,Shoes,Formal Shoes,Black,Autumn,2012,Formal,Lee Cooper Men Formal Black Shoes
12856,Men,Footwear,Shoes,Casual Shoes,Black,Spring,2012,Casual,Lee Cooper Men Formal Black Shoes
12857,Men,Footwear,Shoes,Casual Shoes,Brown,Autumn,2011,Casual,Lee Cooper Men Brown Casual Shoes
12858,Men,Footwear,Sandal,Sandals,Black,Spring,2012,Casual,Lee Cooper Men Casual Black Sandals
12859,Men,Footwear,Shoes,Formal Shoes,Black,Autumn,2012,Formal,Lee Cooper Men Formal Black Shoes
12860,Men,Footwear,Shoes,Formal Shoes,Black,Autumn,2011,Formal,Lee Cooper Men Formal Black Shoes
12861,Men,Footwear,Shoes,Formal Shoes,Black,Spring,2012,Formal,Lee Cooper Men Formal Black Shoes
12862,Men,Footwear,Shoes,Formal Shoes,Black,Autumn,2012,Formal,Lee Cooper Men Formal Black Shoes
12863,Men,Footwear,Shoes,Formal Shoes,Black,Spring,2012,Formal,Lee Cooper Men Black Formal Shoes
12864,Men,Footwear,Shoes,Casual Shoes,Black,Autumn,2012,Casual,Lee Cooper Men Casual Black Shoes
12865,Men,Footwear,Sandal,Sandals,Black,Autumn,2011,Casual,Lee Cooper Men Casual Black Sandals
12866,Men,Footwear,Sandal,Sandals,Black,Spring,2012,Casual,Lee Cooper Men Casual Black Slippers
12867,Men,Footwear,Shoes,Casual Shoes,Black,Autumn,2011,Casual,Lee Cooper Men Casual Black Shoes
12868,Men,Footwear,Shoes,Formal Shoes,Black,Spring,2012,Formal,Lee Cooper Men Formal Black Shoes
12869,Men,Footwear,Sandal,Sandals,Black,Autumn,2011,Casual,Lee Cooper Men Casual Black Sandals
12870,Men,Footwear,Shoes,Casual Shoes,Black,Spring,2012,Casual,Lee Cooper MenCasual Black Shoes
12871,Men,Footwear,Shoes,Formal Shoes,Black,Spring,2012,Formal,Lee Cooper Men Formal Black Shoes
12872,Men,Footwear,Shoes,Formal Shoes,Black,Spring,2012,Formal,Lee Cooper Men Formal Black Shoes
12873,Men,Footwear,Shoes,Formal Shoes,Black,Spring,2012,Formal,Provogue Men Formal Black Formal Shoes
12874,Men,Footwear,Shoes,Casual Shoes,Black,Autumn,2011,Casual,Provogue Men Casual Black Casual Shoes
12875,Men,Footwear,Shoes,Formal Shoes,Black,Spring,2012,Formal,Provogue Men Formal Black Formal Shoes
12876,Men,Footwear,Shoes,Formal Shoes,Black,Autumn,2012,Formal,Provogue Men Formal Black Formal Shoes
12877,Men,Footwear,Shoes,Formal Shoes,Black,Autumn,2011,Formal,Provogue Men Formal Black Formal Shoes
12878,Men,Footwear,Shoes,Formal Shoes,Black,Autumn,2012,Formal,Provogue Men Formal Black Formal Shoes
12879,Men,Footwear,Shoes,Formal Shoes,Black,Spring,2012,Formal,Provogue Men Formal Black Formal Shoes
12880,Men,Footwear,Shoes,Casual Shoes,Black,Spring,2012,Casual,Provogue Men Casual Black Shoes
12881,Men,Footwear,Shoes,Casual Shoes,Black,Autumn,2011,Casual,Provogue Men Casual Black Shoes
12886,Men,Footwear,Shoes,Casual Shoes,Black,Autumn,2011,Casual,Lotto Men Sprint Black Casual Shoes
12888,Men,Footwear,Shoes,Sports Shoes,White,Autumn,2011,Sports,Reebok Men Hex Express LP White Sports Shoes
12889,Men,Footwear,Shoes,Sports Shoes,White,Autumn,2011,Sports,Puma Men Furure Cat White Sports Shoes
12890,Men,Footwear,Shoes,Casual Shoes,Black,Autumn,2011,Casual,Puma Men Cell Tolero Black Casual Shoes
12893,Men,Footwear,Shoes,Formal Shoes,Brown,Autumn,2011,Formal,Hush Puppies Men Jungle Brown Formal Shoes
12895,Boys,Footwear,Shoes,Sports Shoes,Black,Autumn,2012,Sports,Puma Boys Black Furure Cat Remix Sports Shoes
12896,Men,Footwear,Shoes,Casual Shoes,Brown,Autumn,2011,Casual,Puma Men Yacht Battleship Brown Casual Shoes
12900,Men,Footwear,Shoes,Sports Shoes,Black,Spring,2012,Sports,ADIDAS Men Pluto Black Sports Shoes
12902,Women,Footwear,Shoes,Casual Shoes,Black,Autumn,2011,Casual,Puma Women Cabana Racer SL Black Casual Shoes
12905,Women,Footwear,Shoes,Casual Shoes,Purple,Autumn,2011,Casual,Puma Women Casual Purple Casual Shoes
12920,Men,Footwear,Shoes,Casual Shoes,Blue,Spring,2012,Casual,iD Men Casual Blue Shoes
12921,Men,Footwear,Shoes,Casual Shoes,Blue,Autumn,2011,Casual,iD Men Casual Blue Shoes
12924,Men,Footwear,Sandal,Sandals,Black,Spring,2012,Casual,iD Men Casual Black Sandals
12925,Men,Footwear,Shoes,Casual Shoes,Blue,Spring,2012,Casual,iD Men Casual Blue Shoes
12926,Men,Footwear,Shoes,Casual Shoes,Black,Autumn,2012,Casual,iD Men Casual Black Shoes
12927,Men,Footwear,Shoes,Casual Shoes,Black,Autumn,2011,Casual,iD Men Casual Black Shoes
12957,Men,Footwear,Shoes,Sports Shoes,Grey,Autumn,2011,Sports,ADIDAS Men Grey Sports Shoes
12958,Men,Footwear,Shoes,Sports Shoes,Black,Autumn,2011,Sports,ADIDAS Men Sports Black Sports Shoes
12963,Men,Footwear,Shoes,Sports Shoes,Blue,Autumn,2011,Sports,ADIDAS Men Sports Blue Sports Shoes
12967,Men,Footwear,Sandal,Sandals,Black,Autumn,2011,Casual,ADIDAS Men Spry M Black Sandals
