id,gender,masterCategory,subCategory,articleType,baseColour,season,year,usage,productDisplayName
1163,Men,Apparel,Topwear,Tshirts,Blue,Summer,2011,Sports,Nike Sahara Team India Fanwear Round Neck Jersey
1164,Men,Apparel,Topwear,Tshirts,Blue,Winter,2015,Sports,Nike Men Blue T20 Indian Cricket Jersey
1542,Men,Footwear,Shoes,Sports Shoes,White,Autumn,2010,Sports,Puma Men's Ballistic Rubber Shoe
1543,Men,Footwear,Shoes,Casual Shoes,Black,Autumn,2010,Casual,Puma Men Basket-Biz Sneaker
1544,Men,Footwear,Shoes,Casual Shoes,White,Autumn,2010,Casual,Puma Men's Basket Bump Sneaker
1545,Men,Footwear,Shoes,Casual Shoes,White,Autumn,2010,Casual,Puma Men's Speed Cat Shoe
1546,Men,Footwear,Shoes,Casual Shoes,White,Autumn,2010,Casual,Puma Men's Furore White Shoe
1547,Men,Footwear,Shoes,Casual Shoes,Black,Autumn,2010,Casual,Puma Men's Ducati Sneaker
1548,Men,Footwear,Shoes,Sports Shoes,White,Autumn,2010,Sports,Puma Men's Cell Exsis Sneaker
1549,Men,Footwear,Shoes,Sports Shoes,White,Autumn,2010,Sports,Puma Men's Jiyu Slip On Sneaker
1571,Men,Footwear,Shoes,Sports Shoes,White,Autumn,2010,Sports,Kalenji Men's Super Soft Sports Shoes
1587,Men,Footwear,Shoes,Sports Shoes,White,Spring,2010,Sports,Kipsta Men Superfit Football White Shoe
1590,Men,Footwear,Shoes,Sports Shoes,Black,Autumn,2010,Sports,Kipsta Men's F300 Football Shoe
1591,Men,Apparel,Bottomwear,Shorts,Red,Autumn,2010,Sports,Kipsta Men Red Shorts
1592,Men,Footwear,Shoes,Sports Shoes,Red,Summer,2011,Sports,Kipsta Men's Superfit Football Red Shoe
1594,Unisex,Footwear,Shoes,Casual Shoes,Grey,Autumn,2012,Casual,Newfeel Unisex Grey Mesh Lightweight Shoe
1618,Men,Footwear,Shoes,Sports Shoes,White,Summer,2010,Sports,Reebok Men United Runner White
1634,Men,Footwear,Shoes,Sports Shoes,White,Autumn,2010,Sports,Inesis Water Repellent Canaveral Shoes
1635,Unisex,Footwear,Shoes,Casual Shoes,Red,Spring,2011,Casual,Newfeel Unisex Red Comfy Shoes
1636,Men,Footwear,Shoes,Sports Shoes,White,Autumn,2010,Sports,Nike Men Air Zoom Century Shoes
1637,Men,Footwear,Shoes,Sports Shoes,White,Autumn,2010,Sports,Nike Men White Cricket Shoes
1641,Men,Footwear,Shoes,Sports Shoes,Silver,Autumn,2010,Sports,Reebok Men's Hex Run Pure Silver Shoe
1642,Men,Footwear,Shoes,Sports Shoes,White,Autumn,2010,Sports,Reebok Men Winning Stride White Red
1644,Men,Apparel,Topwear,Tshirts,Red,Autumn,2010,Sports,Kipsta Men Loose Fit Round Neck Jersey Red
1645,Men,Apparel,Topwear,Tshirts,Black,Autumn,2010,Sports,Kipsta Men Loose Fit Round Neck Jersey Black
1649,Unisex,Footwear,Shoes,Casual Shoes,Blue,Spring,2012,Casual,Newfeel Unisex Comfy Cool Blue Shoe
1653,Men,Footwear,Shoes,Sports Shoes,Brown,Summer,2010,Sports,Reebok Men's Ventilator Ubiq Shoe
1654,Men,Footwear,Shoes,Sports Shoes,White,Autumn,2010,Sports,Reebok Men's Frisker LP Shoe
1657,Men,Footwear,Shoes,Sports Shoes,White,Autumn,2010,Sports,Reebok Men's White High Wire Shoe
1658,Men,Apparel,Topwear,Jackets,Blue,Autumn,2012,Sports,Nike Men Windrunner Blue Jacket
1727,Unisex,Footwear,Shoes,Casual Shoes,Black,Winter,2015,Casual,Newfeel Unisex Black Lightweight Shoes
1728,Unisex,Footwear,Shoes,Sports Shoes,Green,Autumn,2010,Sports,Newfeel Unisex Green Sports Shoes
1729,Unisex,Footwear,Shoes,Casual Shoes,White,Spring,2011,Casual,Newfeel Unisex White Shoes
1730,Women,Footwear,Shoes,Sports Shoes,Black,Autumn,2010,Sports,Reebok Women Black Pink Frisker Shoe
1731,Women,Footwear,Shoes,Sports Shoes,White,Autumn,2010,Sports,Reebok Women White Blue Frisker Shoes
1782,Men,Footwear,Shoes,Sports Shoes,Black,Autumn,2010,Sports,Kalenji Men's Kapteren Black Shoe
1783,Men,Footwear,Sandal,Sandals,Grey,Spring,2011,Sports,Quechua Men Grey Sandal
1784,Men,Footwear,Shoes,Sports Shoes,White,Autumn,2010,Sports,Lotto Men's Melbourne White-Red Shoe
1785,Men,Footwear,Shoes,Sports Shoes,White,Autumn,2010,Sports,Lotto Men Brighton White-Blue Shoe
1786,Men,Footwear,Shoes,Sports Shoes,White,Autumn,2010,Sports,Lotto Men's Court Logo White Shoe
1787,Men,Footwear,Shoes,Sports Shoes,White,Autumn,2010,Sports,Lotto Men Court Logo White-Silver Shoe
1788,Men,Footwear,Shoes,Sports Shoes,White,Autumn,2010,Sports,Lotto Men's Court-White-Blue Shoe
1789,Men,Footwear,Shoes,Sports Shoes,Orange,Autumn,2010,Sports,Lotto Men OSLO Grey-Orange Shoe
1802,Men,Footwear,Shoes,Sports Shoes,Brown,Spring,2011,Sports,Quechua Men's Arpenaz Flex Yellow Shoe
1805,Men,Footwear,Shoes,Casual Shoes,Beige,Autumn,2010,Casual,Quechua Men Forclaz 1OO Beige Shoe
1806,Men,Footwear,Sandal,Sandals,Brown,Spring,2011,Casual,Quechua Men Arpenaz Brown Sandal
1827,Men,Footwear,Shoes,Sports Shoes,White,Autumn,2010,Sports,Nike Men's Downshifter White/Blue Shoe
1828,Men,Footwear,Shoes,Sports Shoes,White,Autumn,2010,Sports,Nike Men's Air Afterburner Shoe
1831,Men,Footwear,Shoes,Sports Shoes,Black,Autumn,2010,Sports,Nike Men's Air Impetus Shoe
1832,Men,Footwear,Shoes,Sports Shoes,Black,Autumn,2010,Sports,Nike Lunarswift Shoe
1833,Men,Footwear,Shoes,Sports Shoes,Black,Autumn,2010,Sports,Nike Men's Ballista Shoe
1836,Men,Footwear,Shoes,Sports Shoes,Silver,Autumn,2010,Sports,Nike Air Visi Sleek Shoes
1841,Men,Footwear,Shoes,Sports Shoes,White,Autumn,2010,Sports,Puma Men's Calibre Convertible Spike Shoe
1842,Men,Footwear,Shoes,Sports Shoes,White,Autumn,2010,Sports,Puma Men's Calibre Rubber Shoe
1907,Men,Apparel,Topwear,Tshirts,Black,Autumn,2010,Sports,Nike Mens Classic Black T-shirt
1909,Men,Apparel,Topwear,Tshirts,Blue,Autumn,2010,Sports,Nike Mens Classic Sportswear T-shirt
1910,Men,Apparel,Topwear,Tshirts,Black,Autumn,2010,Sports,Nike Men's Classic Patterned T-shirt
1911,Men,Apparel,Topwear,Tshirts,Blue,Autumn,2010,Sports,Nike Mens Manchester United Blues T-shirt
1912,Men,Apparel,Topwear,Tshirts,White,Autumn,2010,Sports,Nike Mens Running White T-shirt
1913,Men,Apparel,Topwear,Tshirts,Black,Autumn,2010,Sports,Nike Mens Seize Victory Black T-shirt
1916,Men,Footwear,Shoes,Sports Shoes,Black,Autumn,2011,Sports,Puma Men's Game Point Shoes
1917,Men,Footwear,Shoes,Casual Shoes,White,Autumn,2010,Casual,Puma Men White Sneakers
1919,Men,Footwear,Shoes,Casual Shoes,Brown,Autumn,2010,Casual,Puma Men's Choco Brown Casual Shoes
1920,Men,Footwear,Shoes,Casual Shoes,Black,Autumn,2011,Casual,Puma Men Graffiti FX Shoes
1923,Women,Footwear,Shoes,Sports Shoes,White,Autumn,2010,Sports,Kalenji Women Running Shoe
1929,Men,Footwear,Shoes,Sports Shoes,Black,Autumn,2010,Sports,Quechua Men's Lighweight Black Shoe
1932,Women,Footwear,Shoes,Casual Shoes,Grey,Autumn,2010,Casual,Quechua Women Arpenaz Flex Grey Shoe
1937,Women,Footwear,Shoes,Sports Shoes,Black,Autumn,2010,Sports,Kalenji Women Black Pink Shoe
1951,Women,Footwear,Shoes,Sports Shoes,Purple,Autumn,2011,Sports,Puma Women Eco Funky Shoes
1962,Men,Footwear,Shoes,Sports Shoes,White,Autumn,2010,Sports,ADIDAS Men's Duramo Leather Shoe
1963,Men,Footwear,Shoes,Sports Shoes,White,Autumn,2010,Sports,ADIDAS Men's Azaro White Shoe
1964,Men,Footwear,Shoes,Casual Shoes,Blue,Winter,2010,Casual,ADIDAS Men's Blue Canvas Shoe
2197,Men,Footwear,Shoes,Sports Shoes,White,Autumn,2010,Sports,ADIDAS Men's Stripe White Run Shoe
2198,Men,Footwear,Shoes,Sports Shoes,White,Autumn,2010,Sports,ADIDAS Men's Sports Shoe
2199,Women,Footwear,Shoes,Casual Shoes,Blue,Autumn,2010,Casual,ADIDAS Women Streaks Blue Shoe
2208,Men,Footwear,Flip Flops,Flip Flops,Black,Autumn,2011,Casual,Puma Mens Drifter Black Flip Flop
2211,Men,Footwear,Sandal,Sandals,Navy Blue,Autumn,2010,Casual,Puma Men Trek Navy Blue Floater
2213,Men,Footwear,Sandal,Sandals,Brown,Autumn,2010,Casual,Puma Men Brown Sandal
2215,Men,Footwear,Sandal,Sandals,Olive,Autumn,2010,Sports,Puma Men Gypsy Olive Sandals
2218,Men,Footwear,Sandal,Sandals,Black,Autumn,2010,Casual,Puma Men F1 Black Sandal
2219,Men,Footwear,Shoes,Casual Shoes,Black,Autumn,2010,Casual,ADIDAS Men's Black Shoe
2220,Men,Footwear,Sandal,Sandals,Black,Autumn,2010,Sports,Puma Men Carbon Black Sandal
2224,Men,Footwear,Sandal,Sandals,Green,Autumn,2010,Casual,Puma Men's Trek Olive Green Sandal
2225,Men,Footwear,Sandal,Sandals,Black,Autumn,2010,Sports,Puma Men Trek Black Sandal
2227,Men,Footwear,Sandal,Sandals,Grey,Autumn,2010,Sports,Puma Men Gypsy Grey Sandal
2230,Men,Footwear,Sandal,Sandals,Black,Autumn,2010,Casual,Puma Men Cruise Black Sandal
2231,Men,Footwear,Sandal,Sandals,Grey,Autumn,2010,Sports,Puma Men Grey Sandal
2233,Men,Footwear,Sandal,Sandals,Black,Autumn,2010,Casual,Puma Men Carbon Sandal
2235,Men,Footwear,Sandal,Sandals,Black,Autumn,2010,Sports,Puma Men Gypsy Black Sandal
2238,Men,Footwear,Flip Flops,Flip Flops,Black,Autumn,2010,Casual,Puma Men's Winglet Grey Navy Flip Flop
2248,Men,Footwear,Flip Flops,Flip Flops,Black,Autumn,2011,Sports,Puma Men's Drifter Black Green Flip Flops
2250,Men,Footwear,Flip Flops,Flip Flops,Red,Autumn,2010,Casual,Puma Mens Winglet Red Flip Flop
2251,Men,Footwear,Flip Flops,Flip Flops,Brown,Autumn,2010,Casual,Puma Mens Winglet Brown Flip Flop
2260,Men,Apparel,Topwear,Tshirts,Black,Autumn,2010,Casual,Nike Mens Blue Polo T-shirt
2265,Women,Apparel,Topwear,Tshirts,Orange,Autumn,2010,Sports,Nike Womens NIKE MILER SS TOP T-shirt
2266,Women,Apparel,Topwear,Tshirts,Green,Autumn,2010,Sports,Nike Green Women T-shirt
2267,Women,Apparel,Topwear,Tshirts,Pink,Autumn,2010,Sports,Nike Pink Women T-shirt
2268,Women,Apparel,Topwear,Sweatshirts,Grey,Autumn,2010,Sports,Nike Grey Women Sweatshirt
2269,Women,Apparel,Topwear,Tshirts,Green,Autumn,2010,Sports,Nike Light Green Women T-shirt
2270,Women,Apparel,Topwear,Tshirts,Pink,Autumn,2010,Casual,Nike JDI Pink Women T-shirt
2271,Men,Apparel,Topwear,Tshirts,Red,Autumn,2010,Sports,Nike Mens Red Polo T-shirt
2272,Men,Apparel,Topwear,Tshirts,Blue,Autumn,2010,Sports,Nike Mens Blue Polo T-shirt
2273,Men,Apparel,Topwear,Tshirts,Red,Summer,2011,Sports,Nike Mens Red Polo T-shirt
2274,Men,Apparel,Topwear,Tshirts,White,Autumn,2010,Sports,Nike Mens AS White T-shirt
2275,Men,Apparel,Topwear,Tshirts,White,Autumn,2010,Sports,Nike Mens Challenger Graphic White T-shirt
2276,Men,Apparel,Topwear,Tshirts,Blue,Autumn,2010,Sports,Nike Mens Challenger Graphic Blue T-shirt
2278,Men,Apparel,Topwear,Tshirts,White,Autumn,2010,Sports,Nike Mens Sphere White T-shirt
2279,Men,Apparel,Topwear,Tshirts,Red,Autumn,2010,Sports,Nike Mens Nike Sphere Red T-shirt
2280,Women,Apparel,Topwear,Tshirts,Pink,Autumn,2010,Sports,Nike Womens Sphere Pink T-shirt
2282,Men,Apparel,Topwear,Tshirts,Grey,Autumn,2010,Sports,Nike Men Grey T-shirt
2283,Men,Apparel,Topwear,Tshirts,Black,Spring,2014,Sports,Nike Men Poly Black T-shirt
2284,Men,Apparel,Topwear,Tshirts,Yellow,Autumn,2010,Sports,Nike Men Yellow T-shirt
2285,Men,Apparel,Topwear,Tshirts,Purple,Autumn,2010,Sports,Nike Men Lavender T-shirt
2286,Men,Apparel,Topwear,Sweatshirts,Black,Autumn,2010,Sports,Nike Men Black Sweatshirt
2287,Men,Apparel,Topwear,Tshirts,White,Summer,2011,Casual,Nike Men White T-shirt
2288,Women,Apparel,Topwear,Tshirts,Black,Autumn,2010,Sports,Nike Women Black T-shirt
2289,Women,Apparel,Topwear,Tshirts,Blue,Autumn,2010,Sports,Nike Women Blue T-shirt
2290,Women,Apparel,Topwear,Tshirts,Pink,Autumn,2010,Sports,Nike Women SS Pink T-shirt
2291,Men,Apparel,Topwear,Tshirts,White,Autumn,2010,Sports,Nike Men White Polo T-shirt
2292,Women,Apparel,Topwear,Tshirts,Black,Autumn,2010,Sports,Nike Women Accuracy Black T-shirt
2293,Women,Apparel,Topwear,Tshirts,Pink,Autumn,2010,Casual,Nike Women Accuracy Pink T-shirt
2294,Women,Apparel,Topwear,Tops,White,Autumn,2010,Sports,Nike Women's Miller Top
2295,Women,Apparel,Topwear,Tshirts,Pink,Autumn,2010,Sports,Nike Women Cruiser Pink T-shirt
2296,Women,Apparel,Topwear,Tshirts,Black,Autumn,2010,Sports,Nike Women DPT Black T-shirt
2297,Women,Apparel,Topwear,Tshirts,Pink,Autumn,2010,Sports,Nike Women DPT Pink T-shirt
2298,Men,Apparel,Topwear,Tshirts,Red,Autumn,2010,Sports,Nike Mens Core Cotton Red T-shirt
2299,Women,Apparel,Topwear,Tshirts,Purple,Autumn,2010,Sports,Nike Women Purple Polo T-shirt
2300,Women,Apparel,Topwear,Tshirts,Pink,Autumn,2010,Sports,Nike Women Pink Polo T-shirt
2301,Men,Apparel,Topwear,Tshirts,White,Autumn,2010,Sports,Nike Mens Manchester United White T-shirt
2302,Women,Apparel,Topwear,Tshirts,White,Autumn,2010,Sports,Nike Women Icon SS White T-shirt
2303,Women,Apparel,Topwear,Tshirts,Pink,Autumn,2010,Sports,Nike Women Icon SS Pink T-shirt
2304,Men,Apparel,Topwear,Tshirts,Red,Summer,2011,Sports,Nike Men's Manchester United Red T-shirt
2305,Women,Apparel,Topwear,Tshirts,Blue,Autumn,2010,Sports,Nike Women Blue Polo T-shirt
2306,Women,Apparel,Bottomwear,Capris,Black,Autumn,2010,Sports,Nike Women Cuffed Black Capris
2307,Women,Apparel,Topwear,Tshirts,Purple,Autumn,2010,Sports,Nike Women Purple Polo T-shirt
2309,Women,Apparel,Topwear,Tshirts,Blue,Autumn,2010,Sports,Nike Women Miller Blue T-shirt
2310,Men,Apparel,Topwear,Tshirts,Red,Autumn,2010,Sports,Nike Mens Raffel Red T-shirt
2311,Women,Apparel,Topwear,Tshirts,Pink,Autumn,2010,Sports,Nike Womens Pink T-shirt
2312,Men,Apparel,Topwear,Tshirts,White,Autumn,2010,Sports,Nike Mens White Polo T-shirt
2313,Women,Apparel,Topwear,Tshirts,White,Autumn,2010,Sports,Nike Womens Green Polo T-shirt
2314,Men,Apparel,Topwear,Tshirts,Black,Autumn,2010,Sports,Nike Mens JDI Black T-shirt
2315,Women,Apparel,Topwear,Tshirts,Pink,Autumn,2010,Sports,Nike Womens Cruiser Pink T-shirt
2316,Men,Apparel,Topwear,Tshirts,Green,Autumn,2010,Sports,Nike Mens Athletic Green T-shirt
2318,Men,Apparel,Topwear,Tshirts,Black,Summer,2011,Sports,Nike Men's Athletic Navy Blue T-shirt
2320,Men,Apparel,Topwear,Tshirts,Black,Summer,2011,Sports,Nike Men's Quoted Black T-shirt
2351,Men,Footwear,Shoes,Sports Shoes,White,Autumn,2010,Sports,Reebok Men's Stripe Silver Shoe
2353,Men,Footwear,Shoes,Sports Shoes,Grey,Summer,2010,Sports,Reebok Men Frisky Attraction Grey Shoe
2367,Men,Footwear,Shoes,Formal Shoes,Brown,Winter,2018,Formal,Red Tape Men's Brown Semi Formal Shoe
2368,Men,Footwear,Shoes,Casual Shoes,Brown,Winter,2018,Casual,Red Tape Brown Casual Men's Shoe
2369,Men,Footwear,Shoes,Casual Shoes,Brown,Winter,2018,Casual,Red Tape Casual Brown Men's Shoe
2370,Men,Footwear,Shoes,Formal Shoes,Black,Winter,2018,Formal,Red Tape Men's Semi Black Formal Shoe
2371,Men,Footwear,Shoes,Casual Shoes,Brown,Winter,2018,Casual,Red Tape Semi Casual Brown Shoe
2372,Men,Footwear,Shoes,Formal Shoes,Black,Winter,2018,Formal,Red Tape Formal Black Men's Shoe
2373,Men,Footwear,Shoes,Formal Shoes,Brown,Winter,2018,Formal,Red Tape Brown Formal Men's Shoe
2374,Men,Footwear,Shoes,Casual Shoes,Brown,Winter,2018,Casual,Red Tape Semi Casual Men's Shoe
2375,Men,Footwear,Shoes,Formal Shoes,Black,Winter,2018,Formal,Red Tape Men's Black Semi Formal Shoe
2376,Men,Footwear,Shoes,Casual Shoes,Brown,Winter,2018,Casual,Red Tape Semi Casual Brown Men's Shoe
2377,Men,Footwear,Shoes,Formal Shoes,Black,Winter,2018,Formal,Red Tape Black Men's Shoe
2378,Men,Footwear,Shoes,Formal Shoes,Black,Winter,2018,Formal,Red Tape Men's Brown Shoe
2379,Men,Footwear,Shoes,Formal Shoes,Black,Winter,2018,Formal,Red Tape Men's Black Formal Shoe
2380,Men,Footwear,Shoes,Casual Shoes,Black,Winter,2018,Casual,Red Tape Black Men Semi Casual Shoe
2381,Men,Footwear,Shoes,Formal Shoes,Brown,Winter,2018,Formal,Red Tape Men's Brown Formal Shoe
2382,Men,Footwear,Shoes,Formal Shoes,Black,Winter,2018,Formal,Red Tape Black Men Formal Shoe
2383,Men,Footwear,Shoes,Casual Shoes,Black,Winter,2018,Casual,Red Tape Casual Semi Men's Shoe
2384,Men,Footwear,Shoes,Formal Shoes,Black,Winter,2018,Formal,Red Tape Men Semi Black Formal Shoes
2385,Men,Footwear,Shoes,Casual Shoes,Brown,Winter,2018,Casual,Red Tape Semi Casual Men's Brown Shoe
2387,Men,Footwear,Shoes,Casual Shoes,Black,Winter,2018,Casual,Red Tape Men Casual Black Shoe
2388,Men,Footwear,Shoes,Casual Shoes,Brown,Winter,2018,Casual,Red Tape Men Brown Casual Shoe
2389,Men,Footwear,Shoes,Casual Shoes,White,Winter,2018,Casual,Red Tape Men Casual White Shoe
2390,Men,Footwear,Shoes,Casual Shoes,Black,Winter,2018,Casual,Red Tape Men's Semi Black Casual Shoe
2391,Men,Footwear,Shoes,Formal Shoes,Black,Winter,2018,Formal,Red Tape Men Formal Black Shoe
2393,Men,Footwear,Shoes,Casual Shoes,Black,Winter,2018,Casual,Red Tape Men's Semi Casual Shoe
2394,Men,Footwear,Shoes,Casual Shoes,Black,Winter,2018,Casual,Red Tape Men's Casual Black Shoe
2396,Men,Footwear,Shoes,Casual Shoes,Black,Winter,2018,Casual,Red Tape Black Men Casual Shoe
2397,Men,Footwear,Shoes,Casual Shoes,Brown,Winter,2018,Casual,Red Tape Men's Brown Casual Shoe
2398,Men,Footwear,Shoes,Casual Shoes,Black,Winter,2018,Casual,Red Tape Men's Semi Black Casual Shoe
2399,Men,Footwear,Shoes,Casual Shoes,Black,Winter,2018,Casual,Red Tape Black Men's Semi Casual Shoe
2474,Men,Footwear,Shoes,Sports Shoes,Black,Autumn,2010,Sports,Nike Men's Dual Fusion Black Shoe
2477,Men,Footwear,Shoes,Sports Shoes,Blue,Autumn,2010,Sports,Nike Men's LunarFly Blue Shoe
2487,Men,Footwear,Sandal,Sandals,Black,Autumn,2010,Casual,Puma Men Rio Fashion Black Sandal
2488,Men,Footwear,Sandal,Sports Sandals,Black,Autumn,2010,Casual,Puma Men Diva Fashion Black Sandal
2489,Women,Footwear,Shoes,Sports Shoes,White,Autumn,2011,Sports,Puma Women Commander White Pink Shoe
2490,Women,Footwear,Shoes,Casual Shoes,White,Summer,2011,Casual,Puma Women Commander White Blue Shoe
2494,Men,Footwear,Flip Flops,Flip Flops,White,Autumn,2010,Casual,Numero Uno Men's Casual White Flip Flop
2495,Men,Footwear,Shoes,Casual Shoes,Black,Autumn,2010,Casual,Numero Uno Men's Casual White Black Stripe Shoe
2496,Men,Footwear,Shoes,Casual Shoes,Black,Autumn,2010,Casual,Numero Uno Men's Casual White Black Leatherette Shoe
2497,Men,Footwear,Shoes,Casual Shoes,Black,Autumn,2010,Casual,Numero Uno Men's Casual Black Shoes
2498,Men,Footwear,Shoes,Casual Shoes,Black,Autumn,2010,Casual,Numero Uno Men's Casual Black Canvas Shoe
2499,Men,Footwear,Shoes,Casual Shoes,Grey,Autumn,2010,Casual,Numero Uno Men's Casual Grey Canvas Shoe
2500,Men,Footwear,Shoes,Casual Shoes,Navy Blue,Autumn,2010,Casual,Numero Uno Men's Casual Navy Blue Canvas Shoe
2501,Men,Footwear,Shoes,Casual Shoes,Red,Autumn,2010,Casual,Numero Uno Men's Casual Red Canvas Shoe
2502,Men,Footwear,Shoes,Casual Shoes,Black,Autumn,2010,Casual,Numero Uno Men's Casual Canvas Black Shoe
2503,Men,Footwear,Shoes,Casual Shoes,Brown,Autumn,2012,Casual,Numero Uno Men's Casual Brown Canvas Shoe
2504,Men,Footwear,Shoes,Casual Shoes,White,Autumn,2010,Casual,Numero Uno Men's Casual White Canvas Shoe
2505,Men,Footwear,Shoes,Casual Shoes,Black,Autumn,2010,Casual,Numero Uno Men's Casual Black Shoe
2506,Men,Footwear,Shoes,Casual Shoes,Brown,Autumn,2010,Casual,Numero Uno Men's Casual Brown Shoe
2507,Men,Footwear,Shoes,Casual Shoes,White,Autumn,2010,Casual,Numero Uno Men's Casual White Sneakers Shoe
2508,Men,Footwear,Shoes,Casual Shoes,Brown,Autumn,2010,Casual,Numero Uno Men's Casual Brown Shoe
2509,Men,Footwear,Shoes,Casual Shoes,Grey,Autumn,2010,Casual,Numero Uno Men's Casual Grey Shoes
2510,Men,Footwear,Shoes,Casual Shoes,Black,Autumn,2010,Casual,Numero Uno Men's Casual Black Leatherette Shoe
2511,Men,Footwear,Shoes,Casual Shoes,Blue,Autumn,2010,Casual,Numero Uno Men's Casual Blue Leatherette Shoe
2540,Men,Footwear,Shoes,Casual Shoes,Blue,Autumn,2010,Casual,Numero Uno Men's Casual Black Leatherette Shoe
2541,Men,Footwear,Shoes,Casual Shoes,White,Summer,2011,Casual,Numero Uno Men's Casual White Shoe
2542,Men,Footwear,Flip Flops,Flip Flops,Black,Summer,2011,Casual,Numero Uno Men's Casual Black Flip Flop
2543,Men,Footwear,Flip Flops,Flip Flops,Green,Autumn,2010,Casual,Numero Uno Men's Casual Green Flip Flop
2544,Men,Footwear,Flip Flops,Flip Flops,Blue,Summer,2011,Casual,Numero Uno Men's Casual Blue Flip Flop
2545,Men,Footwear,Flip Flops,Flip Flops,Red,Summer,2011,Casual,Numero Uno Men's Casual Red Flip Flop
2546,Men,Footwear,Flip Flops,Flip Flops,Black,Autumn,2010,Casual,Numero Uno Men's Casual Graphic Black Flip Flop
2547,Men,Footwear,Flip Flops,Flip Flops,Green,Summer,2011,Casual,Numero Uno Men's Casual Graphic Green Flip Flop
2548,Men,Footwear,Flip Flops,Flip Flops,Navy Blue,Autumn,2010,Casual,Numero Uno Men's Casual Navy Blue Flip Flop
2549,Men,Footwear,Flip Flops,Flip Flops,Red,Summer,2011,Casual,Numero Uno Men's Casual Graphic Red Flip Flop
2550,Men,Footwear,Flip Flops,Flip Flops,Black,Autumn,2010,Casual,Numero Uno Men's Casual Black Graphic Flip Flop
2551,Men,Footwear,Flip Flops,Flip Flops,Green,Summer,2011,Casual,Numero Uno Men's Casual Green Graphic Flip Flop
2552,Men,Footwear,Flip Flops,Flip Flops,Blue,Autumn,2009,Casual,Numero Uno Men's Casual Blue Graphic Flip Flop
2553,Men,Footwear,Flip Flops,Flip Flops,Red,Summer,2011,Casual,Numero Uno Men's Casual Red Graphic Flip Flop
2608,Women,Footwear,Shoes,Heels,Black,Winter,2012,Casual,Carlton London Women Contemporary Black Flats
2609,Women,Footwear,Shoes,Flats,Silver,Autumn,2010,Casual,Carlton London Women Contemporary Silver Sandal
2610,Women,Footwear,Shoes,Heels,Black,Winter,2012,Casual,Carlton London Women Stylish Black Flats
2611,Women,Footwear,Shoes,Heels,Gold,Winter,2012,Casual,Carlton London Women Stylish Gold Flats
2612,Women,Footwear,Shoes,Flats,Black,Autumn,2010,Casual,Carlton London Women Crystal Black Sandal
2613,Women,Footwear,Shoes,Flats,Silver,Autumn,2010,Casual,Carlton London Women Crystal Silver Sandal
2614,Women,Footwear,Shoes,Flats,Beige,Autumn,2010,Casual,Carlton London Women Greek Beige Sandal
2616,Women,Footwear,Shoes,Flats,Gold,Autumn,2010,Sports,Carlton London Women Gold Wedge Sandal
2617,Men,Apparel,Topwear,Tshirts,Red,Summer,2011,Sports,Nike Mens Red Bleed Blue T-shirt
2618,Women,Footwear,Shoes,Flats,Silver,Spring,2010,Casual,Carlton London Women Silver Wedge Sandal
2619,Men,Apparel,Topwear,Tshirts,White,Autumn,2010,Sports,Nike Mens White Bleed Blue T-shirt
2620,Men,Apparel,Topwear,Tshirts,Blue,Autumn,2010,Sports,Nike Men's Colors Team India T-shirt
2621,Men,Apparel,Topwear,Tshirts,Blue,Autumn,2010,Sports,Nike Men's Bleed blue India Colors T-shirt
2622,Men,Apparel,Topwear,Tshirts,Blue,Autumn,2010,Sports,Nike Mens Bleed Blue Team India T-shirt
2623,Women,Footwear,Shoes,Flats,Black,Autumn,2010,Casual,Carlton London Women Black Sandal
2624,Women,Footwear,Shoes,Heels,Black,Winter,2012,Casual,Carlton London Women Black Solid Sandals
2625,Women,Footwear,Shoes,Flats,Gold,Autumn,2009,Casual,Carlton London Women Wedge Gold Sandal
2626,Women,Footwear,Shoes,Flats,Red,Autumn,2010,Casual,Carlton London Women Red Wedge Sandal
2627,Women,Footwear,Shoes,Flats,Silver,Autumn,2010,Casual,Carlton London Women Wedge Silver Sandal
2628,Women,Footwear,Shoes,Flats,Gold,Autumn,2010,Casual,Carlton London Women Four Strapped Gold Sandal
2629,Women,Footwear,Shoes,Flats,Black,Autumn,2010,Casual,Carlton London Women Four Strapped Black Sandal
2630,Women,Footwear,Shoes,Flats,Red,Autumn,2010,Casual,Carlton London Women Four Strapped Red Sandal
2631,Women,Footwear,Shoes,Flats,White,Winter,2012,Casual,Carlton London Women White Ballerinas
2632,Women,Footwear,Shoes,Flats,Pink,Autumn,2010,Casual,Carlton London Women Pink Ballerinas Shoe
2633,Men,Footwear,Shoes,Heels,Black,Summer,2010,Smart Casual,Carlton London Men Black Leather Casual Shoes.
2634,Men,Footwear,Sandal,Sandals,Beige,Autumn,2010,Casual,Carlton London Men Beige Strapped Sandal
2635,Men,Footwear,Sandal,Sandals,White,Autumn,2010,Sports,Carlton London Men White Strapped Sandal
2636,Men,Footwear,Sandal,Sandals,Brown,Autumn,2010,Casual,Carlton London Men Brown Strapped Sandal
2637,Men,Footwear,Shoes,Formal Shoes,Black,Winter,2012,Formal,Carlton London Men's Semi Formal Black Shoe
2638,Men,Footwear,Shoes,Formal Shoes,Brown,Autumn,2010,Formal,Carlton London Men's Semi Formal Coffee Shoe
2639,Men,Footwear,Shoes,Formal Shoes,Brown,Autumn,2010,Formal,Carlton London Men's Formal Brown Shoe
2640,Men,Footwear,Shoes,Formal Shoes,Brown,Winter,2012,Formal,Carlton London Men Brown Formal Shoes
2641,Men,Footwear,Shoes,Casual Shoes,Brown,Autumn,2010,Casual,Carlton London Men's Casual Brown Shoe
2642,Men,Footwear,Shoes,Formal Shoes,Black,Autumn,2010,Formal,Carlton London Men Semi Formal Black Shoe
2691,Boys,Apparel,Bottomwear,Shorts,Blue,Summer,2011,Casual,Disney Kids Boy's Mickey Blue Denim Kidswear
2693,Boys,Apparel,Topwear,Shirts,Yellow,Summer,2011,Casual,Disney Kids Boy's Yellow Kidswear
2694,Boys,Apparel,Topwear,Shirts,Red,Summer,2011,Casual,Disney Kids Boy's Red Twofur Layered Kidswear
2695,Boys,Apparel,Topwear,Tshirts,White,Summer,2011,Casual,Disney Kids Boy's Baby Mickey Surf Kidswear
2697,Girls,Apparel,Dress,Dresses,Blue,Summer,2011,Casual,Disney Kids Girl's Blue Pooh Kidswear
2699,Girls,Apparel,Dress,Dresses,Pink,Summer,2011,Casual,Disney Kids Girls Disney girl pink pooh top Kidswear
2700,Girls,Apparel,Topwear,Tops,White,Summer,2011,Casual,Disney Kids Girl's White Kidswear
2701,Girls,Apparel,Topwear,Tops,Yellow,Summer,2011,Casual,Disney Kids Girl's Yellow Daisy Kidswear
2702,Girls,Apparel,Topwear,Shirts,Blue,Summer,2011,Casual,Disney Kids Girl's Blue Check Kidswear Shirt
2703,Girls,Apparel,Topwear,Tops,Pink,Summer,2011,Casual,Disney Kids Girl's Check Pink Kidswear
2704,Girls,Apparel,Dress,Dresses,White,Summer,2011,Casual,Disney Kids Girl's White Pooh Kidswear
2705,Girls,Apparel,Dress,Dresses,Blue,Summer,2011,Casual,Disney Kids Girl's Blue Pooh Blouse Kidswear
2706,Girls,Apparel,Topwear,Tops,Pink,Summer,2011,Casual,Disney Kids Girl's Pink Pooh Kidswear
2707,Girls,Apparel,Dress,Dresses,Pink,Summer,2011,Casual,Disney Kids Girl's Dress Pink Pooh Kidswear
2708,Girls,Apparel,Dress,Dresses,White,Summer,2011,Casual,Disney Kids Girl's White Dress Pooh Kidswear
2710,Girls,Apparel,Dress,Dresses,White,Summer,2011,Casual,Disney Kids Girl's White Daisy Kidswear
2711,Girls,Apparel,Dress,Dresses,Pink,Summer,2011,Casual,Disney Kids Girl's Halter Neck Pink Kidswear
2712,Girls,Apparel,Dress,Dresses,Blue,Summer,2011,Casual,Disney Kids Girl's Halter Neck Blue Kidswear
2715,Girls,Apparel,Topwear,Tops,Orange,Summer,2011,Casual,Disney Kids Girl's Minnie Orange Stripped Kidswear
2716,Girls,Apparel,Topwear,Tops,Red,Summer,2011,Casual,Disney Kids Girl's Minnie Red Stripped Kidswear
2717,Girls,Apparel,Topwear,Tops,Blue,Summer,2011,Casual,Disney Kids Girls  Kidswear
