id,gender,masterCategory,subCategory,articleType,baseColour,season,year,usage,productDisplayName
4730,Boys,Apparel,Topwear,Tshirts,Blue,Summer,2011,Casual,Disney Kids Boy's Champs Blue Teen Kidswear
4731,Men,Footwear,Flip Flops,Flip Flops,Black,Summer,2011,Casual,Numero Uno Men's Black Casual Flip Flop
4732,Men,Footwear,Flip Flops,Flip Flops,White,Summer,2011,Casual,Numero Uno Men's White Casual Flip Flop
4739,Men,Footwear,Shoes,Casual Shoes,White,Autumn,2012,Casual,Numero Uno Men's White Green Casual Shoe
4740,Men,Footwear,Shoes,Casual Shoes,Black,Summer,2011,Casual,Numero Uno Men's MJ Black White Shoe
4743,Women,Footwear,Shoes,Casual Shoes,Red,Summer,2011,Casual,Numero Uno Women Dna Red Shoe
4857,Men,Apparel,Topwear,Tshirts,Red,Summer,2011,Sports,Nike Men Arsenal Red Jersey
4858,Men,Apparel,Topwear,Tshirts,White,Summer,2011,Sports,Nike Men Utd White Jersey
4859,Men,Apparel,Topwear,Tshirts,Maroon,Summer,2011,Sports,Nike Men Barcelona Maroon Blue Jersey
4867,Men,Apparel,Topwear,Tshirts,Red,Summer,2011,Sports,Nike Men Manchester United Red Jersey
4868,Men,Apparel,Topwear,Tshirts,Orange,Summer,2016,Casual,Levis Kids Boy's Darby Orange Polo Tshirt
4869,Men,Apparel,Topwear,Tshirts,Orange,Summer,2016,Casual,Levis Kids Boy's Orange Polo Tshirt
4870,Men,Apparel,Topwear,Tshirts,Red,Summer,2016,Casual,Levis Kids Boy's Dawson Red Teens Kidswear
4871,Men,Apparel,Topwear,Tshirts,Red,Summer,2016,Casual,Levis Kids Boy's Dawson Red Kidswear
4872,Men,Apparel,Topwear,Tshirts,Grey,Summer,2016,Casual,Levis Kids Boy's Danio Grey Teens Kidswear
4874,Men,Apparel,Topwear,Tshirts,Red,Summer,2016,Casual,Levis Kids Boy's Davis Red Polo Tshirt
4876,Men,Apparel,Topwear,Tshirts,White,Summer,2016,Casual,Levis Kids Boy's Dean White Black Teens Kidswear
4880,Men,Apparel,Topwear,Tshirts,White,Summer,2016,Casual,Levis Kids Boy's Dustin White Teens Kidswear
4881,Men,Apparel,Topwear,Tshirts,White,Summer,2016,Casual,Levis Kids Boy's Dustin White Black Kidswear
4882,Men,Apparel,Topwear,Tshirts,White,Summer,2016,Casual,Levis Kids Boy's Davis White Polo Tshirt
4883,Men,Apparel,Topwear,Tshirts,White,Summer,2016,Casual,Levis Kids Boy's Davis White Polo Tshirt
4884,Women,Apparel,Topwear,Tops,Purple,Summer,2011,Casual,Levis Kids Girl's Darcy Purple Teens Kidswear
4885,Women,Apparel,Topwear,Tops,Purple,Summer,2011,Casual,Levis Kids Girl's Darcy Purple Kidswear
4886,Women,Apparel,Topwear,Tops,Pink,Summer,2011,Casual,Levis Kids Girl's Dana Pink Teens Kidswear
4887,Women,Apparel,Topwear,Tops,Pink,Summer,2011,Casual,Levis Kids Girl's Dana Pink Kidswear
4888,Women,Apparel,Topwear,Tops,White,Summer,2011,Casual,Levis Kids Girl's Dionne White Teens Kidswear
4889,Women,Apparel,Topwear,Tops,White,Summer,2011,Casual,Levis Kids Girl's Dionne White Kidswear
4890,Women,Apparel,Topwear,Tshirts,Pink,Summer,2011,Casual,Levis Kids Girl's Diaz Pink Polo Tshirt
4891,Women,Apparel,Topwear,Tshirts,Pink,Summer,2011,Casual,Levis Kids Girl's Diaz Pink Polo Tshirt
4893,Women,Apparel,Topwear,Tshirts,Green,Summer,2011,Casual,Levis Kids Girl's Diaz Green Polo Tshirt
4894,Women,Apparel,Topwear,Tops,Pink,Summer,2011,Casual,Levis Kids Girl's Darla Pink Teens Kidswear
4895,Women,Apparel,Topwear,Tops,Pink,Summer,2011,Casual,Levis Kids Girl's Darla Pink Kidswear
4896,Women,Apparel,Topwear,Tops,Yellow,Summer,2011,Casual,Levis Kids Girl's Diane Yellow Teens Kidswear
4897,Women,Apparel,Topwear,Tops,Yellow,Summer,2011,Casual,Levis Kids Girl's Diane Yellow Kidswear
4898,Women,Apparel,Topwear,Tops,Green,Summer,2011,Casual,Levis Kids Girl's Desiree Green Teens Kidswear
4900,Women,Apparel,Topwear,Tops,Pink,Summer,2011,Casual,Levis Kids Girl's Desiree Pink Teens Kidswear
4901,Women,Apparel,Topwear,Tops,Pink,Summer,2011,Casual,Levis Kids Girl's Desiree Pink Kidswear
4902,Women,Apparel,Topwear,Tops,Pink,Summer,2011,Casual,Levis Kids Girl's Denise Pink Teens Kidswear
4903,Women,Apparel,Topwear,Tops,Pink,Summer,2011,Casual,Levis Kids Girl's Denise Pink Kidswear
4904,Women,Apparel,Topwear,Tops,White,Summer,2011,Casual,Palm Tree Girl's Billy White Green Kidswear
4905,Women,Apparel,Topwear,Tops,White,Summer,2011,Casual,Palm Tree Girl's Lions White Pink Kidswear
4906,Women,Apparel,Bottomwear,Capris,Blue,Summer,2011,Casual,Palm Tree Girl's Belen Pedal Pusher Kidswear
4907,Women,Apparel,Topwear,Tops,Green,Summer,2011,Casual,Palm Tree Girl's Linnea White Green Kidswear
4908,Women,Apparel,Topwear,Tops,Red,Summer,2011,Casual,Levis Kids Girl's Darcy Red Teens Kidswear
4909,Women,Apparel,Topwear,Tops,Red,Summer,2011,Casual,Levis Kids Girl's Darcy Red Kidswear
4910,Women,Apparel,Topwear,Tops,Pink,Summer,2011,Casual,Levis Kids Girl's Dionne Pink Teens Kidswear
4911,Women,Apparel,Topwear,Tops,Pink,Summer,2011,Casual,Levis Kids Girl's Dionne Pink Kidswear
4912,Women,Apparel,Topwear,Tops,Pink,Summer,2011,Casual,Levis Kids Girls Diane Pink Top
4913,Women,Apparel,Topwear,Tops,Pink,Summer,2011,Casual,Levis Kids Girl's Diane Pink Kidswear
4914,Women,Apparel,Topwear,Tops,White,Summer,2011,Casual,Gini and Jony Girl's Gloria White Peach Kidswear
4915,Women,Apparel,Topwear,Tops,White,Summer,2011,Casual,Gini and Jony Girl's Vollie White Kidswear
4916,Women,Apparel,Topwear,Tops,White,Summer,2011,Casual,Gini and Jony Girl's Vollie White Infant Kidswear
4917,Women,Apparel,Topwear,Tops,Pink,Summer,2011,Casual,Gini and Jony Girl's Vollie Pink Kidswear
4918,Women,Apparel,Topwear,Tops,Pink,Summer,2011,Casual,Gini and Jony Girls Vollie Pink Top
4919,Women,Apparel,Topwear,Tops,Pink,Summer,2011,Casual,Gini and Jony Girl's Veeya Pink Kidswear
4920,Women,Apparel,Topwear,Tops,Pink,Summer,2011,Casual,Gini and Jony Girl's Veeya Pink Infant Kidswear
4930,Women,Apparel,Bottomwear,Skirts,Blue,Summer,2011,Casual,Gini and Jony Girl's Vanida Blue Dungree Infant Kidswear
4931,Women,Apparel,Dress,Dresses,Blue,Summer,2011,Casual,Gini and Jony Girl's Valerie Blue White Kidswear
4932,Women,Apparel,Dress,Dresses,Blue,Summer,2011,Casual,Gini and Jony Girl's Valerie Blue White Infant Kidswear
4933,Women,Apparel,Dress,Dresses,Peach,Summer,2011,Casual,Gini and Jony Girl's Valerie Peach White Kidswear
4934,Women,Apparel,Dress,Dresses,Peach,Summer,2011,Casual,Gini and Jony Girl's Valerie Peach White Infant Kidswear
4935,Women,Apparel,Topwear,Tops,White,Summer,2011,Casual,Gini and Jony Girl's Veata White Black Pink Kidswear
4949,Men,Apparel,Bottomwear,Shorts,Blue,Summer,2011,Casual,Gini and Jony Boy's Kimon Blue Bermuda Kidswear
4950,Men,Apparel,Bottomwear,Shorts,Blue,Summer,2011,Casual,Gini and Jony Boy's Kimon Blue Infant Bermuda Kidswear
4952,Men,Apparel,Bottomwear,Shorts,Black,Summer,2011,Casual,Gini and Jony Boy's Kimon Black Bermuda Infant Kidswear
4967,Men,Apparel,Topwear,Tshirts,Yellow,Summer,2011,Casual,Gini and Jony Boy's Kaffle Yellow Kidswear
4968,Men,Apparel,Topwear,Tshirts,Yellow,Summer,2011,Casual,Gini and Jony Boy's Kaffle Yellow Infant Kidswear
4969,Men,Apparel,Topwear,Tshirts,Blue,Summer,2011,Casual,Gini and Jony Boy's Kay Blue Kidswear
4970,Men,Apparel,Topwear,Tshirts,Blue,Summer,2011,Casual,Gini and Jony Boy's Kay Blue Infant Kidswear
4971,Men,Apparel,Topwear,Shirts,Green,Summer,2011,Casual,Gini and Jony Boy's Kangaroo Green White Infant Kidswear
4972,Men,Apparel,Topwear,Shirts,Green,Summer,2011,Casual,Gini and Jony Boy's Kangaroo Green White Kidswear
4973,Men,Apparel,Topwear,Shirts,Yellow,Summer,2011,Casual,Gini and Jony Boy's Kangaroo Yellow Kidswear
4974,Men,Apparel,Topwear,Shirts,Yellow,Summer,2011,Casual,Gini and Jony Boy's Kangaroo Yellow Infant Kidswear
4977,Men,Apparel,Bottomwear,Jeans,Blue,Summer,2011,Casual,Gini and Jony Boy's Kang Jeans Infant Kidswear
4978,Men,Apparel,Bottomwear,Jeans,Blue,Summer,2011,Casual,Gini and Jony Boy's Kang Jeans Kidswear
4979,Women,Apparel,Topwear,Tops,Pink,Summer,2011,Casual,Palm Tree Girl's Betty Pink Kidswear
4980,Women,Apparel,Bottomwear,Shorts,Blue,Summer,2011,Casual,Palm Tree Girl's Benita Blue Kidswear
4982,Women,Apparel,Topwear,Tops,Peach,Summer,2011,Casual,Palm Tree Girl's Billy Peach Kidswear
4983,Women,Apparel,Dress,Dresses,White,Summer,2011,Casual,Palm Tree Girl's Blenda White Pink Kidswear
4984,Women,Apparel,Dress,Dresses,White,Summer,2011,Casual,Palm Tree Girls Beyonce White & Blue Dress
4987,Women,Apparel,Dress,Dresses,White,Summer,2011,Casual,Gini and Jony Girl's Viveca White Floral Kidswear
4988,Women,Apparel,Dress,Dresses,White,Summer,2011,Casual,Gini and Jony Girl's Vanya White Polka Dot Kidswear
4989,Women,Apparel,Bottomwear,Shorts,Green,Summer,2011,Casual,Gini and Jony Girl's Fenil Bright Green Kidswear
4990,Women,Apparel,Bottomwear,Shorts,White,Summer,2011,Casual,Gini and Jony Girl's Scotia White Purple Kidswear
4998,Men,Footwear,Flip Flops,Flip Flops,Black,Summer,2011,Casual,Fila Men's Talus Black Flip Flop
5000,Women,Apparel,Topwear,Tops,Green,Summer,2011,Casual,Gini and Jony Girl's Gloria Green Kidswear
5001,Women,Apparel,Bottomwear,Capris,Blue,Summer,2011,Casual,Gini and Jony Girl's Tamira Blue Kidswear
5002,Women,Apparel,Bottomwear,Shorts,Pink,Summer,2011,Casual,Gini and Jony Girl's Jolene Pink Kidswear
5003,Women,Apparel,Bottomwear,Shorts,Blue,Summer,2011,Casual,Gini and Jony Girl's Arella Blue Kidswear
5004,Women,Apparel,Bottomwear,Skirts,Blue,Summer,2011,Casual,Gini and Jony Girl's Delma Blue Kidswear
5005,Women,Apparel,Bottomwear,Skirts,Red,Summer,2011,Casual,Gini and Jony Girl's Glinda Red Kidswear
5006,Women,Apparel,Topwear,Tops,Green,Summer,2011,Casual,Gini and Jony Girl's Farica Green Kidswear
5007,Women,Apparel,Dress,Dresses,Purple,Summer,2011,Casual,Gini and Jony Girl's Sandra Purple Kidswear
5008,Women,Apparel,Dress,Dresses,Blue,Summer,2011,Casual,Gini and Jony Girl's Salome Blue Kidswear
5009,Women,Apparel,Topwear,Tops,Blue,Summer,2011,Casual,Gini and Jony Girl's Pacey Blue Kidswear
5011,Women,Apparel,Topwear,Tops,Pink,Summer,2011,Casual,Gini and Jony Girl's Tiana Pink Kidswear
5012,Women,Apparel,Topwear,Tops,Pink,Summer,2011,Casual,Gini and Jony Girl's Peggy Pink Kidswear
5013,Women,Apparel,Topwear,Tops,White,Summer,2011,Casual,Gini and Jony Girl's Peggy White Kidswear
5014,Women,Apparel,Bottomwear,Capris,Navy Blue,Summer,2016,Casual,Levis Kids Girl's Blake Navy Blue Kidswear
5015,Women,Apparel,Bottomwear,Capris,White,Summer,2016,Casual,Levis Kids Girls Alicia White Capris
5017,Women,Apparel,Bottomwear,Capris,Pink,Summer,2016,Casual,Levis Kids Girl's Alicia Pink Kidswear
5018,Men,Apparel,Bottomwear,Shorts,White,Summer,2016,Casual,Levis Kids Boy's Aldon White Kidswear
5020,Men,Apparel,Topwear,Shirts,Black,Summer,2011,Casual,Levis Kids Boy's Caspian Black Kidswear
5021,Men,Apparel,Topwear,Shirts,Red,Summer,2011,Casual,Levis Kids Boy's Calcio Grey Red Kidswear
5022,Men,Apparel,Topwear,Shirts,Blue,Summer,2011,Casual,Levis Kids Boy's Calcio Grey Blue Kidswear
5023,Men,Apparel,Topwear,Shirts,Red,Summer,2011,Casual,Levis Kids Boy's Chad Red Kidswear
5024,Men,Apparel,Topwear,Shirts,White,Summer,2011,Casual,Levis Kids Boy's Caspian White Kidswear
5037,Men,Footwear,Shoes,Casual Shoes,White,Winter,2015,Casual,Fila Men White Ample Shoes
5045,Men,Footwear,Shoes,Casual Shoes,Black,Summer,2012,Casual,Fila Men's Sniper Black Shoe
5055,Men,Footwear,Shoes,Casual Shoes,Black,Summer,2011,Casual,Fila Men's Rakett Black Shoe
5104,Men,Footwear,Sandal,Sandals,Brown,Summer,2011,Casual,Rockport Men's Jelba Brown Flip Flop
5216,Boys,Apparel,Topwear,Tshirts,Green,Summer,2011,Casual,Disney Kids Boys Green T-shirt
5240,Men,Footwear,Shoes,Sports Shoes,Silver,Summer,2011,Sports,Reebok Men's Cruiseon Silver Shoe
5242,Men,Footwear,Shoes,Sports Shoes,White,Summer,2011,Sports,Reebok Men's Zigdhoni White Shoe
5243,Men,Footwear,Shoes,Sports Shoes,Black,Summer,2011,Sports,Reebok Men's Zigdhoni Black Shoe
5291,Men,Footwear,Shoes,Formal Shoes,Black,Summer,2011,Formal,Lee Cooper Men Black Semi Formal Shoe
5292,Men,Footwear,Shoes,Casual Shoes,Brown,Summer,2011,Casual,Lee Cooper Men's Brown Semi Formal Shoe
5315,Women,Footwear,Shoes,Sports Shoes,Grey,Summer,2011,Sports,Nike Women's Airmax Grey Pink Shoe
5316,Men,Footwear,Shoes,Formal Shoes,Brown,Winter,2018,Formal,Red Tape Men's Brown Formal Shoe
5317,Men,Footwear,Shoes,Formal Shoes,Brown,Winter,2018,Formal,Red Tape Men's Slip On Brown Formal Shoe
5320,Men,Footwear,Shoes,Casual Shoes,Grey,Summer,2011,Casual,Fila Men's Montello Grey Black Red Shoe
5324,Men,Footwear,Shoes,Casual Shoes,White,Summer,2011,Casual,Fila Men's Rowley White Red Shoe
5326,Men,Footwear,Shoes,Casual Shoes,Brown,Summer,2011,Casual,Fila Men's Fitness Hiker Brown Shoe
5327,Men,Footwear,Shoes,Casual Shoes,Navy Blue,Summer,2011,Casual,Fila Men's Mountainaire Navy Shoe
5330,Men,Footwear,Shoes,Casual Shoes,Brown,Summer,2011,Casual,Fila Men's Rockridge Slate Shoe
5332,Men,Footwear,Shoes,Casual Shoes,Brown,Summer,2011,Casual,Fila Men's Rockridge Dark Coffee Shoe
5339,Men,Footwear,Shoes,Casual Shoes,Navy Blue,Summer,2011,Casual,Fila Men's Union Navy Pink Shoe
5340,Men,Footwear,Shoes,Casual Shoes,Brown,Summer,2011,Casual,Fila Men's Union Beige Royal Shoe
5341,Women,Footwear,Shoes,Flats,Silver,Summer,2011,Casual,Carlton London Women Silver Floral Print Sandals
5342,Men,Footwear,Shoes,Casual Shoes,Green,Summer,2011,Casual,Fila Men's Fitness Hiker Olive Black Yellow Shoe
5344,Men,Footwear,Shoes,Casual Shoes,Black,Summer,2011,Casual,Lee Cooper Men's Black Shoe
5346,Unisex,Footwear,Shoes,Sports Shoes,Black,Autumn,2011,Sports,Solognac Shoes Inverness 100 Ir
5347,Men,Footwear,Shoes,Sports Shoes,White,Autumn,2011,Sports,Kalenji Elimu White Navy
5352,Men,Footwear,Shoes,Sports Shoes,Black,Summer,2011,Sports,Kalenji Dt. Newfeel Strap Black 09
5353,Women,Footwear,Shoes,Sports Shoes,Blue,Autumn,2011,Sports,Kalenji Ekiden 50 Women
5354,Men,Footwear,Shoes,Sports Shoes,Grey,,2011,Sports,Kalenji Ekiden 50 Wht/grey 09
5356,Men,Footwear,Shoes,Sports Shoes,Red,Autumn,2011,Sports,Kalenji Kapteren Aw Red 2010
5362,Unisex,Footwear,Shoes,Sports Shoes,Red,Summer,2011,Sports,Kipsta First Training Red S209
5368,Men,Footwear,Shoes,Sports Shoes,Red,,2011,Sports,Kalenji Kiprun 1000 White Red Ss10
5369,Unisex,Footwear,Shoes,Sports Shoes,White,Summer,2011,Sports,Artengo 452c Boy Kd White
5370,Men,Footwear,Shoes,Sports Shoes,Black,,2011,Sports,Inesis Canaveral 700 Black
5373,Women,Footwear,Shoes,Sports Shoes,Pink,Summer,2011,Sports,Quechua Women Forclaz 50 Jr 10 Pink Shoes
5374,Men,Footwear,Shoes,Sports Shoes,Red,Summer,2011,Sports,Quechua Jawar 5.0 Man Black Red
5375,Women,Footwear,Shoes,Sports Shoes,Blue,Summer,2011,Sports,Quechua Jawar 5.0 Lady Blue
5380,Women,Footwear,Shoes,Sports Shoes,Purple,,2011,Sports,Quechua Forclaz 100 Lady Purple
5382,Men,Footwear,Shoes,Sports Shoes,Brown,Autumn,2011,Sports,Quechua Arpenaz  300
5383,Men,Footwear,Shoes,Sports Shoes,Black,Autumn,2011,Sports,Quechua Arpenaz 300 Noire
5384,Men,Footwear,Shoes,Sports Shoes,Beige,Summer,2011,Sports,Quechua Arpenaz Flex Man Beige
5385,Women,Footwear,Shoes,Sports Shoes,Blue,,2011,Sports,Quechua Arpenaz Flex  Lady Grey
5386,Unisex,Footwear,Shoes,Sports Shoes,Black,Summer,2011,Sports,Kalenji Kapteren 50 Black Blue
5388,Men,Footwear,Shoes,Sports Shoes,Blue,Summer,2011,Sports,Kalenji Kapteren Tr Grey Blue 2010
5389,Unisex,Footwear,Shoes,Sports Shoes,Yellow,,2011,Sports,Kalenji Kapteren 200 Yellow Fw
5390,Unisex,Footwear,Shoes,Sports Shoes,Grey,,2011,Sports,Kalenji Kapteren 100 Grey Orang
5391,Men,Footwear,Shoes,Sports Shoes,Blue,,2011,Sports,Kalenji Kiprun 2000 Blue Ah10
5393,Men,Footwear,Shoes,Sports Shoes,White,Summer,2011,Sports,Kipsta Match Up V2 Black White
5395,Women,Footwear,Shoes,Sports Shoes,Gold,Summer,2011,Sports,Artengo Artengo Bad 414 I Woman
5396,Men,Footwear,Shoes,Sports Shoes,White,Summer,2011,Sports,Artengo Artengo Bad 414 I Man
5397,Men,Footwear,Shoes,Sports Shoes,Black,Summer,2011,Sports,Artengo Artengo Bad 650 Man
5405,Men,Footwear,Shoes,Sports Shoes,White,Autumn,2011,Sports,Kalenji Ekiden Comfort Prime 2011
5413,Girls,Apparel,Topwear,Tops,Pink,Summer,2011,Casual,Ant Kids Girl's Pink White Check Top Kidswear
5414,Girls,Apparel,Topwear,Tops,Purple,Summer,2011,Casual,Ant Kids Girl's Purple Top With Sequins Kidswear
5415,Girls,Apparel,Topwear,Tshirts,Red,Summer,2011,Casual,Ant Kids Girl's Red Little Heart Kidswear
5416,Girls,Apparel,Topwear,Tshirts,White,Summer,2011,Casual,Ant Kids Girl's White Little Heart Kidswear
5417,Girls,Apparel,Topwear,Tshirts,Blue,Summer,2011,Casual,Ant Kids Girls Blue T-shirt
5418,Girls,Apparel,Topwear,Tshirts,Pink,Summer,2011,Casual,Ant Kids Girl's Pink Free Bird Kidswear
5419,Boys,Apparel,Topwear,Tshirts,Black,Summer,2011,Casual,Ant Kids Boy's Musical Buzz Black Red Kidswear
5420,Boys,Apparel,Topwear,Tshirts,Blue,Summer,2011,Casual,Ant Kids Boy's Love This Game Blue Kidswear
5421,Boys,Apparel,Topwear,Tshirts,White,Summer,2011,Casual,Ant Kids Boy's Love This Game White Kidswear
5422,Boys,Apparel,Topwear,Tshirts,Grey,Summer,2011,Casual,Ant Kids Boy's Blue Grey Kidswear
5423,Boys,Apparel,Topwear,Tshirts,Blue,Summer,2011,Casual,Ant Kids Boy's Grey Blue Kidswear
5424,Boys,Apparel,Topwear,Tshirts,White,Summer,2011,Casual,Ant Kids Boy's Whats Up White Navy Kidswear
5425,Boys,Apparel,Topwear,Shirts,Maroon,Summer,2011,Casual,Ant Kids Boys's Anytime Maroon White Kidswear
5426,Boys,Apparel,Topwear,Tshirts,Black,Summer,2011,Casual,Ant Kids Boy's Black Cartoon Pop Kidswear
5427,Boys,Apparel,Topwear,Tshirts,Red,Summer,2011,Casual,Ant Kids Boy's Red Cartoon Pop Kidswear
5428,Girls,Apparel,Topwear,Tshirts,White,Summer,2011,Casual,Ant Kids Girl's White Free Bird Kidswear
5430,Boys,Apparel,Topwear,Shirts,Green,Summer,2011,Casual,Ant Kids Boy's White Check Kidswear
5431,Boys,Apparel,Topwear,Shirts,Pink,Summer,2011,Casual,Ant Kids Boy's Pink Check Kidswear
5432,Men,Apparel,Topwear,Tshirts,Blue,Summer,2011,Casual,Nike Men's Cruiser Run The City Blue T-shirt
5433,Men,Apparel,Topwear,Tshirts,Red,Summer,2011,Casual,Nike Men's Speed Fury Red T-shirt
5434,Men,Apparel,Topwear,Tshirts,Red,Summer,2011,Sports,Nike Men's Kill Man Red T-shirt
5435,Men,Apparel,Topwear,Tshirts,Grey,Summer,2011,Sports,Nike Men's Encourage The Rookies Grey T-shirt
5436,Men,Apparel,Topwear,Tshirts,Grey,Summer,2011,Sports,Nike Men's Swoosh Grey T-shirt
5437,Men,Apparel,Topwear,Tshirts,White,Summer,2011,Sports,Nike Men's Swoosh White T-shirt
5438,Girls,Apparel,Topwear,Tshirts,Blue,Summer,2011,Casual,Ant Kids Girl's Humming Birds Blue Kidswear
5439,Men,Apparel,Topwear,Tshirts,Red,Summer,2011,Sports,Nike Men's Red Polo T-shirt
5440,Men,Apparel,Topwear,Tshirts,Yellow,Summer,2011,Casual,Nike Men's Club Pique Polo Med Yellow White T-shirt
5441,Girls,Apparel,Topwear,Tops,Purple,Summer,2011,Casual,Ant Kids Girl's Check Top Purple Kidswear
5442,Women,Apparel,Topwear,Tshirts,Blue,Summer,2011,Casual,Nike Women's Striped Polo Blue T-shirt
5443,Women,Apparel,Topwear,Tshirts,Orange,Summer,2011,Casual,Nike Women's Striped Polo Orange T-shirt
5444,Girls,Apparel,Topwear,Tops,Black,Summer,2011,Casual,Ant Kids Girl's Check Top Black Kidswear
5445,Men,Apparel,Topwear,Tshirts,White,Summer,2011,Casual,Nike Men's Training White T-shirt
5446,Men,Apparel,Topwear,Tshirts,Blue,Summer,2011,Casual,Nike Men's Training Blue T-shirt
5447,Boys,Apparel,Topwear,Shirts,Black,Summer,2011,Casual,Ant Kids Boy's Anytime Check Black Shirt Kidswear
5448,Men,Apparel,Topwear,Tshirts,White,Summer,2011,Casual,Nike Men's Training White Blue T-shirt
5449,Men,Apparel,Topwear,Tshirts,Orange,Summer,2011,Sports,Nike Men's Race Day T-shirt
5450,Men,Apparel,Bottomwear,Shorts,Blue,Summer,2011,Sports,Nike Men's Blue Short
5451,Men,Apparel,Bottomwear,Shorts,Blue,Summer,2011,Sports,Nike Men's Tempo Blue Short
5453,Men,Apparel,Bottomwear,Shorts,Grey,Summer,2011,Sports,Nike Men's Vapor Knit Grey Short
5454,Men,Apparel,Bottomwear,Shorts,Black,Summer,2011,Sports,Nike Men's Basic Woven Med Black Short
5455,Boys,Apparel,Topwear,Tshirts,Green,Summer,2011,Casual,Ant Kids Boy's Musical Buzz Green T-Shirts Kidswear
5458,Men,Apparel,Bottomwear,Track Pants,Navy Blue,Summer,2011,Sports,Nike Men Training Knit Navy Blue Track Pant
5459,Men,Footwear,Shoes,Sports Shoes,Grey,Summer,2011,Sports,Nike Men's Dual Fusion Grey Shoe
5460,Women,Footwear,Shoes,Sports Shoes,Black,Summer,2011,Sports,Nike Women's Double Team Lite Black Shoe
5461,Men,Footwear,Shoes,Sports Shoes,Black,Summer,2011,Sports,Nike Men's Downshifter Lea Black Shoe
5486,Boys,Apparel,Topwear,Tshirts,Navy Blue,Summer,2011,Casual,Ant Kids Boy's Whats Up Navy Kidswear
5543,Men,Apparel,Topwear,Tshirts,White,Summer,2011,Sports,Nike Men's Trainning White T-shirt
5544,Men,Apparel,Topwear,Tshirts,Yellow,Summer,2011,Sports,Nike Men's Trainning Orange T-shirt
5545,Men,Apparel,Topwear,Tshirts,Blue,Summer,2011,Casual,Nike Men's Casual Blue T-shirt
5546,Men,Apparel,Topwear,Tshirts,Orange,Summer,2011,Casual,Nike Men's Football Soccer Orange T-shirt
5547,Men,Apparel,Topwear,Tshirts,Green,Summer,2011,Casual,Nike Men's Football/Soccer Green T-shirt
5575,Girls,Apparel,Bottomwear,Skirts,Green,Summer,2011,Casual,Ant Kids Girl's Green Kidswear
5581,Girls,Apparel,Bottomwear,Skirts,Pink,Summer,2011,Casual,Ant Kids Girl's Flower Print Frill Pink Kidswear
5611,Men,Footwear,Sandal,Sandals,Black,Summer,2011,Casual,ADIDAS Men Kendall Black Grey Floater
5621,Women,Footwear,Flip Flops,Flip Flops,Red,Summer,2011,Casual,ADIDAS Women's Adi Zing Red Flip Flop
5622,Women,Footwear,Flip Flops,Flip Flops,Yellow,Summer,2011,Casual,ADIDAS Women's Adi Zing Yellow Flip Flop
5625,Men,Footwear,Flip Flops,Flip Flops,Grey,Summer,2011,Casual,ADIDAS Men's Adi Jumble Grey Flip Flop
5627,Men,Footwear,Flip Flops,Flip Flops,Blue,Summer,2011,Casual,ADIDAS Men's Adi Jumble Blue Flip Flop
5628,Men,Footwear,Flip Flops,Flip Flops,Black,Summer,2011,Casual,ADIDAS Men's Adi Slide Black Yellow Flip Flop
5629,Women,Footwear,Flip Flops,Flip Flops,Pink,Summer,2011,Casual,ADIDAS Women's Adi Groove Pink Flip Flop
5630,Women,Footwear,Flip Flops,Flip Flops,Blue,Summer,2011,Casual,ADIDAS Women's Adi Groove Blue Flip Flop
5631,Unisex,Footwear,Flip Flops,Flip Flops,Yellow,Summer,2011,Casual,ADIDAS Unisex Adi Liner Yellow Flip Flop
5635,Men,Footwear,Flip Flops,Flip Flops,Black,Summer,2011,Casual,ADIDAS Men's Adi Liner Black Blue Flip Flop
5638,Men,Footwear,Flip Flops,Flip Flops,Brown,Summer,2011,Casual,ADIDAS Men's Adi Liner Brown Flip Flop
5641,Men,Footwear,Shoes,Sports Shoes,Brown,Summer,2011,Sports,ADIDAS Men Arcane Brown Shoe
5646,Unisex,Footwear,Flip Flops,Flip Flops,Silver,Autumn,2012,Casual,ADIDAS Unisex Adi Pixel Silver Flip Flop
5647,Women,Footwear,Shoes,Flats,Black,Summer,2011,Casual,ADIDAS Women's Ballerino Black Ballerinas
5654,Men,Footwear,Shoes,Sports Shoes,White,Summer,2011,Sports,Reebok Men's Winning Stride White Shoe
5665,Men,Footwear,Flip Flops,Flip Flops,Grey,Summer,2011,Casual,ADIDAS Men's Slide Grey Orange Flip Flop
5673,Men,Footwear,Shoes,Casual Shoes,Black,Winter,2015,Casual,Skechers Men's Icurbantrack Solver Black Shoe
5674,Men,Footwear,Shoes,Casual Shoes,Brown,Winter,2015,Casual,Skechers Men's Icurbantrack Solver Dark Grey Shoe
5675,Men,Footwear,Shoes,Formal Shoes,Black,Summer,2011,Formal,Skechers Men's Ilets Resolute Black Shoe
5676,Men,Footwear,Shoes,Casual Shoes,Brown,Winter,2015,Casual,Skechers Men's Casual  Charcoal Shoe
5677,Men,Footwear,Shoes,Casual Shoes,Brown,Winter,2015,Casual,Skechers Men's Ilets Resolute Charcolate Shoe
5678,Men,Footwear,Shoes,Casual Shoes,Brown,Winter,2015,Casual,Skechers Men's Slip On Dark Brown Shoe
5679,Men,Footwear,Shoes,Casual Shoes,Black,Winter,2015,Casual,Skechers Men's Diameter Heisman Black Shoe
5680,Men,Footwear,Shoes,Casual Shoes,Black,Winter,2015,Casual,Skechers Men's Compelling Desterity Black Shoe
5681,Men,Footwear,Shoes,Casual Shoes,Brown,Winter,2015,Casual,Skechers Men's Compelling Dexterity Fudge Brown Shoe
5682,Men,Footwear,Shoes,Casual Shoes,Brown,Winter,2015,Casual,Skechers Men's Transparent Brown Shoe
5683,Men,Footwear,Shoes,Casual Shoes,Black,Winter,2015,Casual,Skechers Men's Triumphant Black Shoe
5684,Men,Footwear,Shoes,Casual Shoes,Black,Winter,2015,Casual,Skechers Men Black Shoe
5685,Men,Footwear,Shoes,Casual Shoes,Black,Winter,2015,Casual,Skechers Men's Traffics Black Shoe
5686,Men,Footwear,Shoes,Casual Shoes,Black,Winter,2015,Casual,Skechers Men Regions Black Shoe
5687,Men,Footwear,Shoes,Casual Shoes,Brown,Winter,2015,Casual,Skechers Men's Traffics Brown Shoe
5688,Men,Footwear,Shoes,Casual Shoes,Brown,Winter,2015,Casual,Skechers Men Torino Dark Brown Shoe
5723,Men,Footwear,Shoes,Sports Shoes,Black,Summer,2011,Sports,Reebok Men's Outdoor Black Shoe
5724,Unisex,Footwear,Sandal,Sandals,Black,Summer,2011,Casual,Reebok Unisex Drive Black Floater
5731,Men,Footwear,Shoes,Sports Shoes,Silver,Summer,2011,Sports,Reebok Men's Instant Silver Shoe
5734,Men,Footwear,Shoes,Sports Shoes,White,Summer,2011,Sports,Reebok Men's Dhoni Trainer White Shoe
5744,Men,Footwear,Shoes,Sports Shoes,White,Summer,2011,Sports,Reebok Men's Blaze White Shoe
5752,Men,Footwear,Shoes,Sports Shoes,White,Summer,2011,Sports,Reebok Men's Winning Stride White Shoe
5754,Men,Footwear,Shoes,Sports Shoes,White,Summer,2011,Sports,Reebok Men's World 10 White Shoe
5781,Men,Footwear,Flip Flops,Flip Flops,Grey,Summer,2011,Casual,Reebok Men's Coral Hex Grey Flip Flop
6483,Men,Footwear,Shoes,Formal Shoes,Black,Winter,2018,Formal,Red Tape Men's Formal Lace Black Shoe
6486,Men,Footwear,Shoes,Casual Shoes,Brown,Winter,2018,Casual,Red Tape Men STN Formal Light Brown Shoe
6487,Men,Footwear,Shoes,Formal Shoes,Black,Winter,2018,Formal,Red Tape Men's Black Formal Leather Shoe
6490,Men,Footwear,Shoes,Casual Shoes,Brown,Winter,2018,Casual,Red Tape Men Brown Formal Shoe
6491,Men,Footwear,Shoes,Casual Shoes,Brown,Winter,2018,Casual,Red Tape Men Brown Shoes
6494,Men,Footwear,Shoes,Casual Shoes,Brown,Winter,2018,Casual,Red Tape Men Brown Leather Shoe
6495,Men,Footwear,Shoes,Casual Shoes,Black,Winter,2018,Casual,Red Tape Men's Casual Black Grey Shoe
6497,Men,Footwear,Shoes,Casual Shoes,Brown,Winter,2018,Casual,Red Tape Men's Leather Brown Shoe
6499,Men,Footwear,Shoes,Formal Shoes,Black,Winter,2018,Formal,Red Tape Men's Leather Black Formal Shoe
